Author,Date,Comment,Subreddit,VADER_neg,VADER_neu,VADER_pos,VADER_compound,EMPATH_love,EMPATH_hate,EMPATH_joy,EMPATH_play,EMPATH_positive_emotion,EMPATH_trust,EMPATH_aggression,EMPATH_anger,EMPATH_fear,EMPATH_pain,EMPATH_negative_emotion,Overall_VADER_sentiment,Overall_EMPATH_sentiment
Ricky239,2016-05-29 04:39:23,male gorillas known violent couldnt take chances couldve easily killed kid felt like,news,0.436,0.349,0.214,-0.7263,0.0,0.0,0.0,0.07692307692307693,0.0,0.0,0.07692307692307693,0.0,0.0,0.0,0.15384615384615385,Very Negative,Negative_emotion
RobaBobaLoba,2016-05-29 04:44:11,happen way everything gorillas known violent provoked yeah suck kill,news,0.654,0.24,0.106,-0.9081,0.0,0.1,0.0,0.0,0.0,0.0,0.2,0.0,0.0,0.1,0.2,Very Negative,Aggression
bigwheelin4213,2016-05-29 04:54:16,dont remember long ago 15 years ago happened brookfield zoo chicago area,news,0.0,1.0,0.0,0.0,0.0,0.0,0.0,0.0,0.0,0.0,0.0,0.0,0.0,0.0,0.0,Neutral,Neutral
dementorpoop,2016-05-29 05:01:53,whats even sadder though seems gorilla move child little roughly couple times part seemed trying help child sad sad death,news,0.433,0.481,0.087,-0.8957,0.0,0.0,0.0,0.1,0.0,0.0,0.0,0.0,0.0,0.0,0.15,Very Negative,Negative_emotion
Number6isNo1,2016-05-29 04:57:46,brookfield zoo illinois think around 19992000,news,0.0,1.0,0.0,0.0,0.0,0.0,0.0,0.0,0.0,0.0,0.0,0.0,0.0,0.0,0.0,Neutral,Neutral
thedude71144,2016-05-29 04:35:29,pretty sure simpsons episode,news,0.0,0.267,0.733,0.6705,0.0,0.0,0.0,0.0,0.0,0.0,0.0,0.0,0.0,0.0,0.0,Very Positive,Neutral
MADatfries,2016-05-29 06:23:36,episode simpsons,news,0.0,1.0,0.0,0.0,0.0,0.0,0.0,0.0,0.0,0.0,0.0,0.0,0.0,0.0,0.0,Neutral,Neutral
KanekiFucksTouka,2016-05-29 07:35:12,remember watching episode cartoon exactly happens think simpsons,news,0.0,1.0,0.0,0.0,0.0,0.0,0.0,0.0,0.0,0.0,0.0,0.0,0.0,0.0,0.0,Neutral,Neutral
forestfly1234,2016-05-29 14:23:00,many years ago brookfield zoo chicago,news,0.0,1.0,0.0,0.0,0.0,0.0,0.0,0.0,0.0,0.0,0.0,0.0,0.0,0.0,0.0,Neutral,Neutral
XxsquirrelxX,2016-05-29 21:32:13,gorilla looked rather calm freaked dragged kid across habitat heard lot people leaning shouting kid id wager scared shit gorilla theyre territorial started dragging kid around knowing kid danger,news,0.345,0.596,0.06,-0.875,0.0,0.0,0.0,0.13793103448275862,0.0,0.0,0.034482758620689655,0.0,0.034482758620689655,0.034482758620689655,0.06896551724137931,Very Negative,Play
AzrianHunter,2016-05-30 07:28:51,brookefield zoo illinois im area ish,news,0.0,1.0,0.0,0.0,0.0,0.0,0.0,0.0,0.0,0.0,0.0,0.0,0.0,0.0,0.0,Neutral,Neutral
Northsole16,2016-05-31 01:23:50,brookfield zoo illinois,news,0.0,1.0,0.0,0.0,0.0,0.0,0.0,0.0,0.0,0.0,0.0,0.0,0.0,0.0,0.0,Neutral,Neutral
HazMat68W,2016-05-31 15:56:29,gorilla trained doll bring keepers inspection prior incident helped,news,0.0,1.0,0.0,0.0,0.0,0.0,0.0,0.1111111111111111,0.0,0.0,0.0,0.0,0.0,0.0,0.0,Neutral,Play
junkyard_robot,2016-05-29 05:16:26,brookfield zoo right took figured would show comments female gorilla saved boy children lost one something male gorillas much aggressive feel like could ended similarly however cant control huge animals,news,0.162,0.691,0.147,0.1124,0.03333333333333333,0.0,0.0,0.03333333333333333,0.0,0.0,0.03333333333333333,0.0,0.0,0.03333333333333333,0.03333333333333333,Very Positive,Love
Led_Hed,2016-05-29 06:46:40,7 billion humans planet compared fewer couple hundred thousand gorillas humans born every single day gorillas left alive approaching 2 1 rapidly child danger gorilla maybe maybe every single gorilla planet danger us definitely,news,0.174,0.691,0.136,-0.3612,0.0,0.0,0.0,0.029411764705882353,0.029411764705882353,0.0,0.0,0.0,0.0,0.0,0.0,Negative,Play
torenvalk,2016-05-29 09:45:11,great ape keeper 8 years truly familyi spent time human family saw every working day like children responsible care also like favorite pet innocent well clever kind funny entire life wrapped care stay work check one stay overnight one sick literally job lose one like losing family member funny face saw every day gone wont see play laugh learn wont hear happy grumbles see pineapple watch puzzle piece enrichment gave wont gift valuable toys knotted pieces hay passing mesh rooms like want give something maybe want pineapple whole group mourn look days fighting group might get depressed awful everyone understand zoo made decision tragedy gorilla group keepers zoo community heart breaks everyone knew,news,0.225,0.486,0.288,0.8167,0.0,0.008849557522123894,0.0,0.017699115044247787,0.05309734513274336,0.02654867256637168,0.0,0.0,0.008849557522123894,0.008849557522123894,0.061946902654867256,Very Positive,Negative_emotion
__lewiskiniski,2016-05-29 07:39:34,im glad see absolutely adore cincinnati zoo heartbroken keepers going well sad many reasons,news,0.291,0.354,0.354,0.1513,0.07142857142857142,0.0,0.0,0.0,0.07142857142857142,0.0,0.0,0.0,0.0,0.0,0.14285714285714285,Very Positive,Negative_emotion
Penis-Butt,2016-05-29 09:35:35,also feel special response team take gorilla people work zoos love animals usually paid little work last thing would want hurt one animals basically dedicated lives caring,news,0.088,0.541,0.371,0.875,0.07407407407407407,0.0,0.0,0.0,0.037037037037037035,0.0,0.0,0.0,0.0,0.07407407407407407,0.037037037037037035,Very Positive,Love
kharneyFF,2016-05-29 11:30:38,hate hater absolutely insane parents irresponsible prosecuted child endangerment held responsible loss creature im familiar gorilla exibit took gross negligence result 3yo ending inside exibit,news,0.517,0.425,0.058,-0.9542,0.0,0.04,0.0,0.04,0.0,0.04,0.0,0.0,0.0,0.04,0.08,Very Negative,Negative_emotion
ObviousAnswerGuy,2016-05-29 08:44:58,makes think return jedi rancor gets killed trainer runs starts crying read old book tales jabbas palace kevin anderson goes detail trainer pretty cool,news,0.23,0.604,0.166,-0.4767,0.0,0.0,0.0,0.0,0.0,0.0,0.0,0.0,0.0,0.0,0.08333333333333333,Negative,Negative_emotion
Childish_Gamboner,2016-05-29 16:38:56,buddy mine college works closely gorillas worked one every single day equated losing family member,news,0.157,0.843,0.0,-0.3818,0.0,0.0,0.0,0.06666666666666667,0.06666666666666667,0.0,0.0,0.0,0.0,0.0,0.06666666666666667,Negative,Play
jaked122,2016-05-29 12:00:37,get buried top comment dont know enough gorillas know wouldve definitely killed kid edit see killed gorilla,news,0.34,0.491,0.17,-0.7579,0.0,0.0,0.0,0.058823529411764705,0.0,0.0,0.0,0.0,0.0,0.0,0.11764705882352941,Very Negative,Negative_emotion
east_coast_and_toast,2016-06-01 22:20:50,thank sharing genuinely wondering effected zookeepers cant imagine heartbroken angry must,news,0.0,0.38,0.62,0.8871,0.0,0.09090909090909091,0.0,0.0,0.0,0.0,0.09090909090909091,0.0,0.0,0.09090909090909091,0.18181818181818182,Very Positive,Negative_emotion
SurlyDrunkard,2016-05-29 11:52:34,sorry dumb question answered could tranquilized gorilla take long actually pass getting shot,news,0.367,0.633,0.0,-0.5859,0.0,0.0,0.0,0.0,0.0,0.0,0.0,0.0,0.0,0.0,0.0,Very Negative,Neutral
gabbamac21,2016-05-29 12:09:43,like luke killed jabbas rancor,news,0.45,0.3,0.25,-0.4588,0.0,0.0,0.0,0.0,0.0,0.0,0.0,0.0,0.0,0.0,0.2,Negative,Negative_emotion
Neithan91,2016-05-29 18:35:14,like return jedi rancor,news,0.0,0.545,0.455,0.3612,0.0,0.0,0.0,0.0,0.0,0.0,0.0,0.0,0.0,0.0,0.0,Very Positive,Neutral
Artimpaired,2016-05-29 19:34:13,kill gorilla going improve barriers chances low get hands another kid,news,0.368,0.378,0.254,-0.4767,0.0,0.09090909090909091,0.0,0.09090909090909091,0.0,0.0,0.09090909090909091,0.0,0.0,0.09090909090909091,0.09090909090909091,Negative,Hate
bleedblue89,2016-06-01 00:10:45,girlfriends great ape keeper loves animals theyre truly great animals smart loving fun friends stories get hear,news,0.0,0.245,0.755,0.9814,0.058823529411764705,0.0,0.0,0.058823529411764705,0.11764705882352941,0.058823529411764705,0.0,0.0,0.0,0.0,0.0,Very Positive,Positive_emotion
Somebodycares311,2016-05-29 10:25:36,agree tragic amazing wonderful distant cousins group devastated struggle animal kept captivity whether endangered hear one beautiful beasts killed incompetent parent clearly busy actually watch child around enclosure housing wild dangerous animals pains makes even adamant captive animals used profit guise education another example destructive ignorant humans,news,0.359,0.398,0.243,-0.8555,0.0,0.0,0.0,0.0425531914893617,0.0,0.02127659574468085,0.0425531914893617,0.0,0.0,0.02127659574468085,0.02127659574468085,Very Negative,Play
slorebear,2016-05-29 14:38:18,put fucking parents,news,0.0,1.0,0.0,0.0,0.0,0.0,0.0,0.0,0.0,0.0,0.0,0.0,0.0,0.0,0.3333333333333333,Neutral,Negative_emotion
plastic_eyelid,2016-05-29 22:31:06,know multiple people zoo including worked gorilla killed devastated especially main gorilla keeper truly like losing family member given much time spend animals bond build still preferable brains blown offspring retards fell prison house human observation deck,news,0.283,0.61,0.106,-0.875,0.0,0.0,0.0,0.0,0.05405405405405406,0.0,0.0,0.0,0.0,0.0,0.05405405405405406,Very Negative,Positive_emotion
ah_23,2016-05-29 09:22:59,hold shooting end result tranquillise animal andor sedate rather kill,news,0.343,0.657,0.0,-0.6908,0.0,0.1,0.0,0.0,0.0,0.0,0.1,0.0,0.0,0.1,0.1,Very Negative,Hate
suka-blijat-003,2016-05-29 08:13:44,let natural selection job let child maimed eaten hed get darwin award eventually like would total waste,news,0.115,0.535,0.35,0.6908,0.0,0.0,0.0,0.058823529411764705,0.0,0.0,0.0,0.0,0.0,0.0,0.0,Very Positive,Play
cashmaster_luke_nuke,2016-05-29 11:10:40,agree child moron would rather gorilla live dopey child tough look parents whole mess fault,news,0.442,0.446,0.112,-0.7506,0.0,0.0,0.0,0.13333333333333333,0.0,0.06666666666666667,0.0,0.0,0.0,0.0,0.06666666666666667,Very Negative,Play
NeverBenCurious,2016-05-29 13:01:57,sad couldnt disable gorilla like tranquilizers distract food something,news,0.638,0.362,0.0,-0.7789,0.0,0.0,0.0,0.0,0.0,0.0,0.0,0.0,0.0,0.0,0.1111111111111111,Very Negative,Negative_emotion
Milkman127,2016-05-29 13:36:15,let dumb kid die natural selection,news,0.567,0.236,0.197,-0.6908,0.0,0.0,0.0,0.16666666666666666,0.0,0.0,0.0,0.0,0.0,0.0,0.16666666666666666,Very Negative,Play
tjsaccio,2016-05-29 13:38:22,option tranquilize animal get kid fine 7 billion people earth im pretty sure thousand gorillas left take chance try tranq,news,0.0,0.569,0.431,0.8225,0.0,0.0,0.0,0.05,0.0,0.0,0.0,0.0,0.0,0.0,0.0,Very Positive,Play
gbimmer,2016-05-29 17:52:32,put shoes parents thinking 10 seconds become willing pull trigger remorse ever imagine toddler know silverback could rip arms andre giant literally oh probably pissed reddit would put feelings handler feelings parent disgusting,news,0.244,0.756,0.0,-0.8658,0.0,0.030303030303030304,0.0,0.030303030303030304,0.0,0.0,0.0,0.0,0.0,0.0,0.06060606060606061,Very Negative,Negative_emotion
RedMage58,2016-05-29 10:42:38,better make barbedelectrified wire keep humans,news,0.0,0.633,0.367,0.4404,0.0,0.0,0.0,0.0,0.3333333333333333,0.0,0.0,0.0,0.0,0.0,0.0,Very Positive,Positive_emotion
Spacey_Penguin,2016-05-29 11:35:42,clumps dirt,news,0.706,0.294,0.0,-0.34,0.0,0.0,0.0,0.0,0.0,0.0,0.0,0.0,0.0,0.0,0.0,Negative,Neutral
beefat99,2016-05-29 13:12:49,kid climbed small fence bushes without anyone saying anything child leashes things,news,0.0,1.0,0.0,0.0,0.0,0.0,0.0,0.16666666666666666,0.0,0.0,0.0,0.0,0.0,0.0,0.0,Neutral,Play
TheR1ckster,2016-05-29 10:24:49,important thing natural part barrier bushes big pit side kid fell,news,0.109,0.58,0.312,0.4215,0.0,0.0,0.0,0.09090909090909091,0.0,0.0,0.0,0.0,0.0,0.0,0.0,Very Positive,Play
CurryF4rts,2016-05-29 23:56:24,thank god sense design raptor paddock,news,0.0,0.465,0.535,0.5574,0.16666666666666666,0.0,0.0,0.0,0.0,0.0,0.0,0.0,0.16666666666666666,0.0,0.0,Very Positive,Love
semperlol,2016-05-29 10:01:54,wow shitty fence,news,0.429,0.119,0.452,0.0516,0.0,0.0,0.0,0.0,0.0,0.0,0.0,0.0,0.0,0.0,0.0,Very Positive,Neutral
DieHalle,2016-05-29 20:06:00,people saying small fence zoos something like people actually see generally dropoff pit animals cant get reach people,news,0.055,0.817,0.128,0.3455,0.0,0.0,0.0,0.0,0.0,0.0,0.0,0.0,0.0,0.0,0.0,Very Positive,Neutral
B-Knight,2016-05-29 21:10:33,see photo exhibit massive ravine animals people hell kid get put danger something else im seeing dangerous thing looks like massive gap small kid could potentially fall point gorilla least worries edit saw video turns kid actually fall massive fucking hole parent wouldve guessed fucking idiots like dont deserve breed,news,0.178,0.705,0.117,-0.6973,0.0,0.0,0.0,0.06,0.0,0.02,0.02,0.0,0.0,0.04,0.08,Very Negative,Negative_emotion
pug_grama2,2016-05-30 06:29:33,doesnt seem safe small children would holding hands people say protective point view im alert dangers others dont notice,news,0.235,0.672,0.092,-0.5277,0.0,0.0,0.0,0.0,0.0,0.05263157894736842,0.0,0.0,0.0,0.0,0.0,Very Negative,Trust
HillbillyInHouston,2016-05-29 11:13:15,shitapple doesnt fall far shittree jim lahey,news,0.0,1.0,0.0,0.0,0.0,0.0,0.0,0.0,0.0,0.0,0.0,0.0,0.0,0.14285714285714285,0.0,Neutral,Pain
Kinda1OfAKind,2016-05-29 11:40:19,surely rules dont apply special little snowflake,news,0.222,0.492,0.285,0.1635,0.0,0.0,0.0,0.0,0.0,0.0,0.0,0.0,0.0,0.0,0.0,Very Positive,Neutral
HowCanYouBuyTheSky,2016-05-29 07:56:54,parents children converted fish food thatll teach feed fish,news,0.0,1.0,0.0,0.0,0.0,0.0,0.0,0.0,0.0,0.0,0.0,0.0,0.0,0.0,0.0,Neutral,Neutral
Dunderost,2016-05-29 08:03:41,9 knocked fucking alligators glass aparantly motherfuckers jump high,news,0.0,1.0,0.0,0.0,0.0,0.0,0.0,0.0,0.0,0.0,0.0,0.0,0.0,0.0,0.1111111111111111,Neutral,Negative_emotion
only_sometimes_haiku,2016-05-29 09:33:15,haha take trashcan put floor right young man family try terrible go bother zoo animal,news,0.268,0.585,0.146,-0.3612,0.0,0.06666666666666667,0.0,0.0,0.06666666666666667,0.0,0.0,0.0,0.0,0.0,0.06666666666666667,Negative,Hate
bigehlittlesee,2016-05-29 14:39:38,best dive tank come junk thats rusted cant even guess long someone threw,news,0.0,0.741,0.259,0.6369,0.0,0.0,0.0,0.0,0.0,0.0,0.0,0.0,0.0,0.0,0.0,Very Positive,Neutral
TheGreatOneSea,2016-05-29 18:15:45,signs papers nearby explain might seem obvious people generally idea actually harmful forbidden actions often done maybe put x days since rules broken sign never stop everyone helped semipublic places ive worked,news,0.165,0.782,0.053,-0.6139,0.0,0.0,0.0,0.0,0.0,0.0,0.0,0.0,0.0,0.0,0.03125,Very Negative,Negative_emotion
dt_jenny,2016-05-31 19:40:25,totally get burried relevant needed share plus everyone loves sweet justice bronx zoo reptile house watched asshole kids banging glass trying get animal move zoo attendant asked nicely stop course little hoodlums didnt wasnt parent sight kids 13ish werent paying mind zoo employee banging glass yet another enclosure got right behind yelled bang bang bang jumped screamed stared horror solidified crazy lady status ranting scary like well neither animals cut swiftly exited reptile house hope learned sort lesson zoo employee giggled mercilessly throughout whole thing gave thumbs ex mortified,news,0.136,0.631,0.233,0.8841,0.0,0.0,0.0,0.0,0.011235955056179775,0.0,0.0,0.0,0.011235955056179775,0.011235955056179775,0.033707865168539325,Very Positive,Negative_emotion
thebeatsandreptaur,2016-05-29 08:08:58,reason dont knock glass get putting things water knocking ive told life never given reason,news,0.0,1.0,0.0,0.0,0.0,0.0,0.0,0.0,0.13333333333333333,0.0,0.0,0.0,0.0,0.0,0.13333333333333333,Neutral,Positive_emotion
diesel_stinks_,2016-05-29 04:18:14,exs sister would wait someone else stop daughter inappropriate things didnt ever want bad guy appalling,news,0.285,0.578,0.137,-0.2668,0.0,0.0625,0.0,0.0,0.0,0.0,0.0,0.0,0.0,0.0625,0.125,Negative,Negative_emotion
Subari,2016-05-29 04:56:55,goddamn dumb people kids today son playing river building dam kid came started break son told forcefully stop 5 year old cried ran mom told go back knock let son handle got kid dam blocking access kid ran back mom crying told go punch son nose thats stepped sat son explaining parents ignorant doubt kid end jail one day hurt feelings destroy something someone,news,0.345,0.633,0.022,-0.9766,0.0,0.0,0.0,0.078125,0.0,0.0,0.0,0.0,0.0,0.015625,0.078125,Very Negative,Play
darkm0d,2016-05-29 06:05:01,hate mail something else wish way take horrific shit kids say behind glorious wall anonymity show parents like hey look failed child literally social disaster,news,0.42,0.374,0.207,-0.8934,0.0,0.04,0.0,0.04,0.04,0.0,0.0,0.0,0.0,0.0,0.04,Very Negative,Hate
misspeelled,2016-05-29 03:44:57,reminds last time went dallas zoo dumb asshole throwing cheetos gorilla enclosure course gorilla ate wouldnt guy kept throwing everyone cheered every time go find zookeeper another section get stop even guy laughed big deal feeding fucking junk food endangered species,news,0.113,0.758,0.129,0.2023,0.0,0.0,0.0,0.0,0.0,0.024390243902439025,0.0,0.0,0.0,0.0,0.04878048780487805,Very Positive,Negative_emotion
AnthillOmbudsman,2016-05-29 02:46:49,zoo staff member walked told stop parent would scold zoo worker say special snowflake child hurting anybody,news,0.326,0.558,0.116,-0.5994,0.0,0.0,0.0,0.058823529411764705,0.0,0.0,0.0,0.0,0.0,0.058823529411764705,0.11764705882352941,Very Negative,Negative_emotion
Ensvey,2016-05-29 04:05:21,saw kid fall eagle enclosure zoo last year mom jump fish,news,0.0,1.0,0.0,0.0,0.0,0.0,0.0,0.09090909090909091,0.0,0.0,0.0,0.0,0.0,0.09090909090909091,0.0,Neutral,Play
kaodneb,2016-05-29 04:13:08,nailed awful thing happen takes little effort responsibility avoid terrible situation humanity destroying habitats endangering lives animal inhabitants zoos one refuge animals even sanctuaries animals still danger danger dumb humans shitty decisions story makes sad,news,0.522,0.478,0.0,-0.9807,0.0,0.05714285714285714,0.0,0.0,0.0,0.02857142857142857,0.0,0.0,0.0,0.0,0.05714285714285714,Very Negative,Hate
OnePunkArmy,2016-05-29 04:25:47,went pet adoption fair april woman holding screaming baby cage kitten baby kept screaming terrifying kitten woman held baby least 15 seconds afterwards saw poor kitten shaking cage woman left kitten got poop,news,0.319,0.628,0.053,-0.886,0.0,0.0,0.0,0.0,0.0,0.0,0.0,0.0,0.030303030303030304,0.09090909090909091,0.0,Very Negative,Pain
StretchFrenchTerry,2016-05-29 04:13:35,im cincinnati people visit zoo absolute worst depressing zoo amazing people cant trusted follow basic rules theyre remember really pissed flash photography nocturnal cats exhibit last time visited one small reason many dont live cincinnati anymore,news,0.283,0.639,0.078,-0.8734,0.0,0.0,0.0,0.0,0.027777777777777776,0.0,0.0,0.0,0.0,0.0,0.08333333333333333,Very Negative,Negative_emotion
jonnyzrow,2016-05-29 06:07:52,zoos zoos zoos zoos zoos zoos zoos,news,0.0,1.0,0.0,0.0,0.0,0.0,0.0,0.0,0.0,0.0,0.0,0.0,0.0,0.0,0.0,Neutral,Neutral
jvnane,2016-05-29 05:54:48,one going mention fucking bat shit crazy uthrworeer,news,0.522,0.478,0.0,-0.7609,0.0,0.0,0.0,0.0,0.0,0.0,0.0,0.0,0.0,0.0,0.25,Very Negative,Negative_emotion
batfiend,2016-05-29 06:33:04,jesus guys post history grim unrelenting tool,news,0.381,0.619,0.0,-0.5719,0.0,0.0,0.0,0.0,0.0,0.0,0.14285714285714285,0.14285714285714285,0.0,0.0,0.0,Very Negative,Aggression
Harlem_Homie,2016-05-29 02:48:35,zoo blame poor design parents blame fucking responsible,news,0.545,0.276,0.179,-0.6494,0.0,0.25,0.0,0.0,0.0,0.125,0.0,0.0,0.0,0.0,0.375,Very Negative,Negative_emotion
narwhaleicorn,2016-05-29 05:51:22,wow kid needs get life anger management class,news,0.274,0.444,0.281,0.0258,0.0,0.125,0.0,0.125,0.0,0.0,0.125,0.125,0.0,0.0,0.0,Positive,Hate
paulisdeadnow,2016-05-29 05:53:36,guy right apostrophe want little overboard,news,0.0,0.794,0.206,0.0772,0.0,0.0,0.0,0.0,0.0,0.0,0.0,0.0,0.0,0.0,0.0,Very Positive,Neutral
Gorgonpistol,2016-05-29 05:54:20,man feel really sad whoever pmed paragraph obviously dont life going well get worked apostrophe,news,0.286,0.714,0.0,-0.6378,0.06666666666666667,0.0,0.0,0.0,0.0,0.0,0.0,0.0,0.0,0.06666666666666667,0.06666666666666667,Very Negative,Love
youmusthailallah,2016-05-29 06:45:05,ahhh neckbeardus jabronious natural habitat mothers basement behind pc covered cheetos dust elusive noxious creature wishes naught terrible things would victims often symptomatic actually requires culling encouraged sedation however deep enough,news,0.142,0.684,0.174,0.0516,0.0,0.03225806451612903,0.0,0.0,0.0,0.0,0.0,0.0,0.0,0.0,0.03225806451612903,Very Positive,Hate
Dlicious11,2016-05-29 04:27:54,way humans act sometimes probably think belong exhibit dont incredible dumb smart species like humans,news,0.116,0.617,0.267,0.4486,0.0,0.0,0.0,0.0,0.0,0.0,0.0,0.0,0.0,0.0,0.0,Very Positive,Neutral
blessedbemyself,2016-05-29 04:21:58,bad enough displace animals deplorably isolate natural habitats favor caged enclosure entertainment people go annoy animals,news,0.313,0.382,0.305,-0.0516,0.0,0.0625,0.0,0.0625,0.0,0.0,0.0,0.0,0.0,0.0625,0.0625,Negative,Hate
porterpottie,2016-05-29 05:03:46,ha thats nothing think people shit heads zoos america went beijing zoo guy threw water bottle bengal tiger absolute favorite animal sleeping entertaining fucker enough didnt language skills bitch watched horror chinese tourists smiled went normally watching shit,news,0.139,0.502,0.359,0.8938,0.0,0.0,0.0,0.0,0.0,0.0,0.0,0.0,0.02631578947368421,0.0,0.0,Very Positive,Fear
Thistleknot,2016-05-29 05:06:19,put predictable animals exhibit cant expect large amount humans act predictably,news,0.0,1.0,0.0,0.0,0.0,0.0,0.0,0.0,0.0,0.0,0.0,0.0,0.0,0.0,0.0,Neutral,Neutral
---LEMON---,2016-05-29 05:06:22,yeah families suck zoo toronto zoo sign said orangutan died 1998 ate food thrown family zoo seem bring worst people,news,0.368,0.556,0.076,-0.8555,0.0,0.0,0.0,0.0,0.05,0.0,0.0,0.0,0.0,0.0,0.05,Very Negative,Positive_emotion
The-Prophet-Muhammad,2016-05-29 06:43:09,obviously hatemail someone mentally disturbed report hell get banned subreddit im pretty sure hell put watch global ban,news,0.527,0.315,0.158,-0.9313,0.0,0.0,0.0,0.05555555555555555,0.0,0.0,0.0,0.0,0.0,0.0,0.1111111111111111,Very Negative,Negative_emotion
EWSTW,2016-05-29 05:55:02,damn pissed wrong english teacher,news,0.833,0.167,0.0,-0.875,0.0,0.0,0.0,0.0,0.0,0.2,0.0,0.0,0.0,0.0,0.4,Very Negative,Negative_emotion
onehundredtwo,2016-05-29 04:29:53,dude zoo last week woman pounding glass trying wake jaguar walked kindof looked sheepishly said hes moving walked around corner started pounding side,news,0.0,1.0,0.0,0.0,0.0,0.0,0.0,0.0,0.0,0.0,0.0,0.0,0.0,0.08695652173913043,0.0,Neutral,Pain
TheZiggurat614,2016-05-29 04:39:58,last line would result world lines,news,0.0,1.0,0.0,0.0,0.0,0.0,0.0,0.0,0.0,0.0,0.0,0.0,0.0,0.0,0.0,Neutral,Neutral
bluerose1197,2016-05-29 04:52:11,ive seen adults pound glass zoos,news,0.0,1.0,0.0,0.0,0.0,0.0,0.0,0.0,0.0,0.0,0.0,0.0,0.0,0.0,0.0,Neutral,Neutral
VeritasWay,2016-05-29 05:00:13,seems like zoos actually built keep us harming animals versus way around,news,0.224,0.621,0.155,-0.2732,0.0,0.0,0.0,0.0,0.08333333333333333,0.0,0.0,0.0,0.0,0.0,0.0,Negative,Positive_emotion
TexasMaritime,2016-05-29 05:05:20,houston zoo wednesday walked past several roosters free roam zoo 10 year old boy dumped water bottle one roosters mother laughed walked past,news,0.093,0.69,0.217,0.5574,0.0,0.0,0.0,0.043478260869565216,0.0,0.0,0.0,0.0,0.0,0.0,0.0,Very Positive,Play
X5953,2016-05-29 05:13:13,dont know act like decent human stay fuck home streets would near empty,news,0.426,0.574,0.0,-0.7514,0.0,0.0,0.0,0.0,0.0,0.0,0.0,0.0,0.0,0.0,0.0,Very Negative,Neutral
twentysacked,2016-05-29 05:25:41,thats even real problem though locking wild animals viewing pleasure,news,0.188,0.556,0.257,0.25,0.1,0.0,0.0,0.0,0.0,0.0,0.0,0.0,0.0,0.0,0.0,Very Positive,Love
Raudskeggr,2016-05-29 05:25:53,lowland gorillas endangered soiled little human children unfortunately tranqed gorilla leaft kid chances gorillas irreplaceable,news,0.19,0.704,0.106,-0.1119,0.0,0.0,0.0,0.06666666666666667,0.0,0.0,0.0,0.0,0.0,0.0,0.0,Negative,Play
FairlyIncompetent,2016-05-29 05:29:30,one time zoo stared straight baboon stared back awkward minute got massive boner walked away defeated,news,0.24,0.663,0.097,-0.4215,0.0,0.0,0.0,0.0,0.0,0.0,0.0,0.0,0.0,0.0,0.0,Negative,Neutral
Outlaw0311,2016-05-29 05:32:43,visit yellowstone national park youll lose faith humanity,news,0.235,0.522,0.243,0.0258,0.0,0.0,0.0,0.0,0.125,0.0,0.0,0.0,0.0,0.0,0.125,Positive,Positive_emotion
HAL9000000,2016-05-29 05:34:47,people dont know decent human beings supervise kids people pay attention types warnings youre giving youre preaching choir missing culprits culprits oblivious thats theyre culprits,news,0.199,0.719,0.082,-0.34,0.0,0.0,0.0,0.0,0.0,0.0,0.0,0.0,0.0,0.0,0.0,Negative,Neutral
Damn_Croissant,2016-05-29 05:35:04,zoos fine,news,0.0,0.357,0.643,0.2023,0.0,0.0,0.0,0.0,0.0,0.0,0.0,0.0,0.0,0.0,0.0,Very Positive,Neutral
Googlesnarks,2016-05-29 05:40:10,youre decent human go figuring,news,0.0,1.0,0.0,0.0,0.0,0.0,0.0,0.0,0.0,0.0,0.0,0.0,0.0,0.0,0.0,Neutral,Neutral
nickability,2016-05-29 05:40:19,irony people wild untamed animals exactly need zoo,news,0.146,0.854,0.0,-0.0516,0.0,0.0,0.0,0.0,0.0,0.0,0.0,0.0,0.0,0.0,0.0,Negative,Neutral
dick_long_wigwam,2016-05-29 05:43:34,hey guys yall dont know act around animals placed cages gonna place cage im super serious guys,news,0.064,0.743,0.193,0.5574,0.0,0.0,0.0,0.0,0.0,0.0,0.0,0.0,0.0,0.0,0.0,Very Positive,Neutral
