Author,Date,Comment,Subreddit,VADER_neg,VADER_neu,VADER_pos,VADER_compound,EMPATH_love,EMPATH_hate,EMPATH_joy,EMPATH_play,EMPATH_positive_emotion,EMPATH_trust,EMPATH_aggression,EMPATH_anger,EMPATH_fear,EMPATH_pain,EMPATH_negative_emotion,Overall_VADER_sentiment,Overall_EMPATH_sentiment
M80IW,2016-05-29 15:43:41,someone jumped enclosure try help kid would likely reaction gorilla,news,0.0,0.769,0.231,0.4019,0.0,0.0,0.0,0.1,0.0,0.0,0.0,0.0,0.0,0.0,0.0,Very Positive,Play
fireysaje,2016-05-29 18:06:17,sad feel like situation couldve handled differently video really didnt look like gorilla hurting seems like killing gorilla wasnt right choice,news,0.312,0.459,0.229,-0.5719,0.047619047619047616,0.0,0.0,0.0,0.0,0.0,0.0,0.0,0.0,0.09523809523809523,0.14285714285714285,Very Negative,Negative_emotion
Testsubject28,2016-05-29 18:23:58,wondering could used tranquilizer seconds act situation shot kill opinion,news,0.42,0.58,0.0,-0.7003,0.0,0.1,0.0,0.0,0.0,0.0,0.1,0.0,0.0,0.1,0.1,Very Negative,Hate
Loltrollbehold,2016-05-30 09:19:25,sad parents names photos made public pay atleast small price loss life owing negligence also breed futher,news,0.327,0.673,0.0,-0.7003,0.0,0.0,0.0,0.0,0.0,0.0,0.0,0.0,0.0,0.058823529411764705,0.058823529411764705,Very Negative,Pain
psychgirl88,2016-06-03 00:22:30,hey little late game couldnt called trusted ape trainer two get kid,news,0.188,0.812,0.0,-0.3724,0.0,0.0,0.0,0.16666666666666666,0.0,0.0,0.0,0.0,0.0,0.0,0.0,Negative,Play
DeadPrateRoberts,2016-05-29 11:48:14,bad gorillas taste damn good,news,0.559,0.18,0.261,-0.5106,0.0,0.2,0.0,0.0,0.0,0.0,0.0,0.0,0.0,0.2,0.2,Very Negative,Hate
laststance,2016-05-29 10:43:45,fair zoos also supposed redesign enclosures every decade add safety features many newer zoos dont even let see large dangerous animals way jump barrier mostly thick glass also lot older zoos designed animals cant escape keep people thats suicide lion guy able get enclosure,news,0.198,0.707,0.095,-0.6724,0.0,0.0,0.0,0.0,0.022727272727272728,0.0,0.022727272727272728,0.0,0.0,0.0,0.0,Very Negative,Positive_emotion
Tattycakes,2016-05-29 19:34:17,child able crawl arent fences floor ceiling gaps big enough children,news,0.0,1.0,0.0,0.0,0.0,0.0,0.0,0.09090909090909091,0.0,0.0,0.0,0.0,0.0,0.0,0.0,Neutral,Play
Fahsan3KBattery,2016-05-30 11:22:17,exactly thought sad happened important thing right find responsible make sure go jail long time,news,0.151,0.537,0.312,0.3182,0.0,0.0,0.0,0.0,0.0,0.06666666666666667,0.0,0.0,0.0,0.0,0.06666666666666667,Very Positive,Trust
plasticenewitch,2016-05-29 12:23:57,would take minutes tranquilizer take effect time gorilla could killed child even though seemed perplexed instead violent seconds react best could heart goes agonising kill,news,0.461,0.437,0.102,-0.93,0.0,0.04,0.0,0.04,0.0,0.0,0.08,0.0,0.0,0.04,0.16,Very Negative,Negative_emotion
neuronuggets,2016-05-29 12:10:13,question,news,0.0,1.0,0.0,0.0,0.0,0.0,0.0,0.0,0.0,0.0,0.0,0.0,0.0,0.0,0.0,Neutral,Neutral
FreeFacts,2016-05-29 08:23:09,also close fire stations hospitals let natural selection thing everywhere seriously natural selection happen unfortunately gorilla one nature select would deemed threat would made simple natural selection,news,0.265,0.535,0.201,-0.34,0.0,0.037037037037037035,0.0,0.0,0.0,0.0,0.037037037037037035,0.0,0.0,0.0,0.0,Negative,Hate
chrisdolemeth,2016-05-29 08:54:55,dont understand even think like,news,0.0,0.615,0.385,0.3612,0.0,0.0,0.0,0.0,0.0,0.0,0.0,0.0,0.0,0.0,0.0,Very Positive,Neutral
ThePr1d3,2016-05-29 09:49:13,wait natural process murder lol,news,0.392,0.167,0.442,-0.1027,0.0,0.0,0.0,0.0,0.0,0.0,0.0,0.0,0.0,0.0,0.0,Negative,Neutral
NAFI_S,2016-05-29 10:48:27,gorillas peaceful would never attack child,news,0.0,0.41,0.59,0.696,0.0,0.0,0.0,0.16666666666666666,0.0,0.0,0.16666666666666666,0.0,0.0,0.0,0.0,Very Positive,Play
skatchawan,2016-05-31 18:12:19,thought thing last time saw gorillas wildi think san diego first one saw shit hand ate walked around corner next one puked hand ate still managed go enclosure hit clumps dirt,news,0.214,0.631,0.155,-0.34,0.0,0.0,0.0,0.0,0.0,0.0,0.0,0.0,0.0,0.03225806451612903,0.03225806451612903,Negative,Pain
Odoyl-Rules,2016-05-29 15:56:03,exactly one ever give people shit using allowed others bully using leash backpack daughter know 9p deletion syndrome good parent would able control kid instead tether right almost ran front bus lived honolulu time,news,0.167,0.762,0.071,-0.5994,0.0,0.029411764705882353,0.0,0.029411764705882353,0.0,0.0,0.0,0.0,0.0,0.0,0.0,Very Negative,Hate
c0reyann,2016-05-29 15:56:10,eyewitness said tried catch yelled stop kept going ignoring everyones screams come back also said kid kept saying going mom wanted get water,news,0.262,0.738,0.0,-0.7269,0.0,0.0,0.0,0.043478260869565216,0.0,0.0,0.0,0.0,0.0,0.0,0.08695652173913043,Very Negative,Negative_emotion
outofvogue,2016-05-30 05:29:08,remember used shirts builtin collars age luckily obedient enough need though mom always threatened use,news,0.155,0.674,0.171,0.0772,0.0,0.0,0.0,0.0,0.0,0.0,0.06666666666666667,0.0,0.0,0.0,0.06666666666666667,Very Positive,Aggression
yoochun,2016-05-31 03:57:30,get im interested things like idea start,news,0.0,0.49,0.51,0.6369,0.0,0.0,0.0,0.0,0.0,0.0,0.0,0.0,0.0,0.0,0.0,Very Positive,Neutral
ChickenInASuit,2016-05-29 16:34:42,zoos fault well proper barriers even moat thats still pathetically small barrier goddamn gorilla enclosure,news,0.455,0.45,0.095,-0.7906,0.0,0.0,0.0,0.0,0.0,0.0,0.0,0.0,0.0,0.0,0.06666666666666667,Very Negative,Negative_emotion
ChrissiTea,2016-05-29 10:47:16,massive moat side enough deter people crossing edit 30 years,news,0.0,1.0,0.0,0.0,0.0,0.0,0.0,0.0,0.0,0.0,0.0,0.0,0.0,0.0,0.0,Neutral,Neutral
AllegrettoVivamente,2016-05-29 10:49:25,mean fences arent meant impassable meant deterrent hey dont fucking go way id say exactly mean mean solid fence would parents balancing children top,news,0.0,0.866,0.134,0.34,0.0,0.0,0.0,0.0,0.0,0.0,0.0,0.0,0.0,0.0,0.16666666666666666,Very Positive,Negative_emotion
TheSleepingNinja,2016-05-29 17:06:57,ever zoo standard fencing like every zoo planet keep short people see put deep moat animals cant cross,news,0.0,0.872,0.128,0.3612,0.0,0.0,0.0,0.0,0.05555555555555555,0.0,0.0,0.0,0.0,0.0,0.0,Very Positive,Positive_emotion
Didnt_get_the_joke_,2016-05-29 10:39:27,dont see people putting blame parents little rail isnt going act barrier anyone,news,0.162,0.745,0.093,-0.257,0.0,0.07692307692307693,0.0,0.0,0.0,0.0,0.0,0.0,0.0,0.0,0.07692307692307693,Negative,Hate
mrs_arigold,2016-05-29 12:40:30,kind fence expect zoo people go view things throw huge wooden privacy fence drill holes people squint,news,0.0,0.725,0.275,0.6908,0.0,0.0,0.0,0.0,0.0,0.0,0.0,0.0,0.0,0.0,0.0,Very Positive,Neutral
wingspantt,2016-05-30 04:24:00,big fucking deal,news,0.0,1.0,0.0,0.0,0.0,0.0,0.0,0.0,0.0,0.3333333333333333,0.0,0.0,0.0,0.0,0.3333333333333333,Neutral,Trust
TossMeFloss,2016-05-29 23:21:46,well put,news,0.0,0.323,0.677,0.2732,0.0,0.0,0.0,0.0,0.0,0.0,0.0,0.0,0.0,0.0,0.0,Very Positive,Neutral
Libertypop,2016-05-29 18:05:06,im mowing air rand im mowing air jim lahey,news,0.0,1.0,0.0,0.0,0.0,0.0,0.0,0.0,0.0,0.0,0.0,0.0,0.0,0.0,0.0,Neutral,Neutral
bad88,2016-05-29 13:35:12,gold give,news,0.0,1.0,0.0,0.0,0.0,0.0,0.0,0.0,0.0,0.0,0.0,0.0,0.0,0.0,0.0,Neutral,Neutral
TheFlixter,2016-05-29 14:50:13,please tell us happened,news,0.0,0.566,0.434,0.3182,0.0,0.0,0.0,0.0,0.0,0.0,0.0,0.0,0.0,0.0,0.0,Very Positive,Neutral
IHeppyI,2016-05-29 08:19:54,speed sound higher dense mediums travels 43 times fast water 1484 ms nearly 15 times fast iron 5120 ms air knocking glass loud everything water,news,0.0,1.0,0.0,0.0,0.0,0.0,0.0,0.0,0.0,0.0,0.0,0.0,0.0,0.0,0.0,Neutral,Neutral
cantgetno197,2016-05-29 08:21:45,cruel thing shouldnt really need explained theyre living creatures get nervousanxiousfeel threatened challenged asshat humans keep coming make loud sudden noises around also dont guy uses flash photography nocturnal animals almost beat shit father 2 kept last time zoo,news,0.253,0.747,0.0,-0.8891,0.0,0.02564102564102564,0.0,0.0,0.02564102564102564,0.0,0.02564102564102564,0.0,0.0,0.0,0.05128205128205128,Very Negative,Negative_emotion
CamenSeider,2016-05-29 05:11:11,sounds like doesnt want parent,news,0.182,0.446,0.372,0.3134,0.0,0.0,0.0,0.0,0.0,0.0,0.0,0.0,0.0,0.0,0.0,Very Positive,Neutral
milkcustard,2016-05-29 05:23:42,soon someone elses going police feel sorry kid,news,0.157,0.843,0.0,-0.0772,0.125,0.0,0.0,0.125,0.0,0.0,0.0,0.0,0.0,0.125,0.0,Negative,Love
1knightstands,2016-05-29 05:37:36,best advice parent friendly without friend youre parent first foremost,news,0.154,0.411,0.435,0.6977,0.0,0.0,0.0,0.0,0.1,0.1,0.0,0.0,0.0,0.0,0.0,Very Positive,Positive_emotion
ellinorianne,2016-05-29 05:32:07,thats winds police saying,news,0.0,1.0,0.0,0.0,0.0,0.0,0.0,0.0,0.0,0.0,0.0,0.0,0.0,0.0,0.0,Neutral,Neutral
Scroon,2016-05-29 05:38:34,ive seen mom waits someone else correct kid tells kid stop man said always thought moms didnt realize bad kid acting reminded apparently correct,news,0.081,0.813,0.105,0.1655,0.0,0.041666666666666664,0.0,0.125,0.0,0.0,0.0,0.0,0.0,0.041666666666666664,0.08333333333333333,Very Positive,Play
Chunkeeguy,2016-05-29 06:39:27,gives new depth word fucktard,news,0.506,0.494,0.0,-0.6249,0.0,0.0,0.0,0.0,0.0,0.0,0.0,0.0,0.0,0.0,0.0,Very Negative,Neutral
Lokifent,2016-05-29 06:22:25,wtf cages accessible year,news,0.559,0.441,0.0,-0.5859,0.0,0.0,0.0,0.0,0.0,0.0,0.0,0.0,0.0,0.0,0.0,Very Negative,Neutral
2evil,2016-05-29 08:14:00,kid lost arm negligence father,news,0.365,0.635,0.0,-0.3182,0.0,0.0,0.0,0.2,0.0,0.0,0.0,0.0,0.0,0.0,0.2,Negative,Play
Chipnstein,2016-05-29 08:34:21,dunno read kind stuff smile natural selection working fine im glad please none kid age knew fear things bigger ne unless adult told fine even behind cage,news,0.081,0.481,0.438,0.9022,0.0,0.0,0.0,0.037037037037037035,0.037037037037037035,0.0,0.037037037037037035,0.037037037037037035,0.037037037037037035,0.0,0.0,Very Positive,Play
Mx1163,2016-05-29 08:36:31,quote article made tough choice made right choice yeah im sure gorilla already life sentence fucking zoo dead dumb twat couldnt bother watch kid gorilla gorilla parent wasnt parent seems like theres little sense brazil least course parents sue hospital costs emotional damages didnt know kid might bad day left unattended wild animals,news,0.309,0.562,0.129,-0.9443,0.018867924528301886,0.018867924528301886,0.0,0.05660377358490566,0.0,0.0,0.0,0.0,0.018867924528301886,0.018867924528301886,0.05660377358490566,Very Negative,Play
Danzig5050,2016-05-29 09:09:06,thank god kid wasnt killed due fathers negligence,news,0.0,0.379,0.621,0.8014,0.0,0.0,0.0,0.125,0.0,0.0,0.0,0.0,0.0,0.0,0.125,Very Positive,Play
DoctorVanHelsing,2016-05-29 06:29:03,thats infuriating kudos letting kid sort things type parent want aware enough know whats going perceptive enough know time step,news,0.136,0.68,0.184,0.0516,0.0,0.0,0.0,0.05,0.0,0.0,0.0,0.0,0.0,0.0,0.0,Very Positive,Play
TheGreyMage,2016-05-29 11:14:24,good parent lady im pretty sure behaviour actions could defined criminal especially one day kids reaction snubbed simply told something criminal hate say really think need contact social services area woman shouldnt allowed parent,news,0.276,0.552,0.172,-0.7269,0.0,0.029411764705882353,0.0,0.0,0.0,0.0,0.0,0.0,0.0,0.0,0.029411764705882353,Very Negative,Hate
Hiinnocentimdad,2016-05-29 09:23:10,wow supreme parenting side people like hiding swear like decent parenting becoming rarer rarer,news,0.143,0.336,0.521,0.875,0.0,0.0,0.0,0.0,0.0,0.0,0.0,0.0,0.0,0.0,0.07142857142857142,Very Positive,Negative_emotion
cross-eye-bear,2016-05-29 11:09:50,dude say anything mom,news,0.0,1.0,0.0,0.0,0.0,0.0,0.0,0.0,0.0,0.0,0.0,0.0,0.0,0.0,0.0,Neutral,Neutral
CheesyDorito101,2016-05-29 13:49:28,rraisedbyassholes rraisedhynarcassists exists,news,0.0,1.0,0.0,0.0,0.0,0.0,0.0,0.0,0.0,0.0,0.0,0.0,0.0,0.0,0.0,Neutral,Neutral
Argyleskin,2016-05-29 06:25:05,point would told hubs take son back car used said mom telling special snowflake hit kid new addition dam wedge right cant get seriously youre good person screaming would heard someone tell kid hit mine yeah probably wouldnt handling quite well child wasnt earshot,news,0.089,0.731,0.179,0.5701,0.0,0.022727272727272728,0.0,0.06818181818181818,0.0,0.0,0.0,0.0,0.0,0.06818181818181818,0.045454545454545456,Very Positive,Play
CentsScentsSense,2016-05-29 08:50:39,shouldve punched mother nose,news,0.0,1.0,0.0,0.0,0.0,0.0,0.0,0.0,0.0,0.0,0.0,0.0,0.0,0.0,0.0,Neutral,Neutral
WalropsHunter,2016-05-29 06:25:01,listened podcast recently female journalist maybe gamerjournalist sick ridiculous shit shed get anytime underaged kid would send something horrible shed scour social media send mom message hilarious,news,0.343,0.585,0.072,-0.8807,0.0,0.037037037037037035,0.0,0.037037037037037035,0.0,0.0,0.0,0.0,0.0,0.037037037037037035,0.07407407407407407,Very Negative,Negative_emotion
Osiris32,2016-05-29 06:29:39,read dudes comment history hes asshole,news,0.0,1.0,0.0,0.0,0.0,0.0,0.0,0.0,0.0,0.0,0.0,0.0,0.0,0.0,0.0,Neutral,Neutral
RobMillsyMills,2016-05-29 07:19:53,say,news,0.0,1.0,0.0,0.0,0.0,0.0,0.0,0.0,0.0,0.0,0.0,0.0,0.0,0.0,0.0,Neutral,Neutral
thellios,2016-05-29 07:05:04,projection yo,news,0.0,1.0,0.0,0.0,0.0,0.0,0.0,0.0,0.0,0.0,0.0,0.0,0.0,0.0,0.0,Neutral,Neutral
emersonthird,2016-05-29 12:07:34,got late deleted say,news,0.0,1.0,0.0,0.0,0.0,0.0,0.0,0.0,0.0,0.0,0.0,0.0,0.0,0.0,0.0,Neutral,Neutral
Rindan,2016-05-29 05:29:53,bit different guy literally hear voice god says jump lion pit eat insane,news,0.171,0.696,0.133,-0.1531,0.0,0.0,0.0,0.0,0.0,0.0,0.0,0.0,0.0,0.0,0.07692307692307693,Negative,Negative_emotion
higgshmozon,2016-05-29 04:57:26,young man letter dont know would categorized suicide note christian drawings lions lions drawings things said lion fabry said adding mans mother recently died another local report stated victim signed note jesus said god would protect,news,0.222,0.675,0.102,-0.7579,0.0,0.0,0.0,0.0,0.0,0.0,0.0,0.0,0.0,0.0,0.0,Very Negative,Neutral
Abhinow,2016-05-29 06:18:42,something similar happened delhi zoo guy jumped inside tiger enclosure take selfie things thankfully zoo officials decided tiger valuable allowed kill idiot,news,0.251,0.564,0.185,-0.4767,0.0,0.045454545454545456,0.0,0.0,0.0,0.0,0.045454545454545456,0.0,0.0,0.045454545454545456,0.045454545454545456,Negative,Hate
kaylazombiekat,2016-05-29 06:47:07,came say fucking ridiculous,news,0.482,0.518,0.0,-0.4201,0.0,0.0,0.0,0.0,0.0,0.0,0.0,0.0,0.0,0.0,0.25,Negative,Negative_emotion
peterPEPPERSCHNICKEL,2016-05-29 05:47:49,sucks two lions got killed depression joke suicide isnt selfish either trapped room thought one way outwouldnt try go,news,0.438,0.346,0.217,-0.8648,0.0,0.05263157894736842,0.0,0.0,0.0,0.0,0.0,0.0,0.0,0.0,0.10526315789473684,Very Negative,Negative_emotion
goodvibeswanted2,2016-05-29 07:06:54,hope lives think hell feel remorse,news,0.532,0.238,0.23,-0.5859,0.16666666666666666,0.0,0.0,0.0,0.16666666666666666,0.0,0.0,0.0,0.0,0.16666666666666666,0.16666666666666666,Very Negative,Love
NonaJabiznez,2016-05-29 11:02:37,fair seems like guy seriously mentally ill different kid parents wont follow rules destruction animals case huge loss situations bit different,news,0.22,0.453,0.327,0.5103,0.0,0.047619047619047616,0.0,0.047619047619047616,0.0,0.0,0.0,0.0,0.0,0.047619047619047616,0.0,Very Positive,Hate
thefountainpenteen,2016-05-29 07:08:23,dude probably depression something didnt think straight think calling stupid selfish assuming much without knowing situation fullh,news,0.477,0.523,0.0,-0.8971,0.0,0.058823529411764705,0.0,0.0,0.0,0.0,0.0,0.0,0.0,0.0,0.058823529411764705,Very Negative,Hate
barandor,2016-05-29 07:44:42,removed crowd would saved zoo feeding day 2 2 bullets,news,0.0,0.714,0.286,0.4215,0.0,0.0,0.0,0.0,0.0,0.0,0.0,0.0,0.0,0.0,0.0,Very Positive,Neutral
typicalredditorscum,2016-05-29 05:03:34,hope lives yeah thatll show,news,0.0,0.37,0.63,0.6249,0.0,0.0,0.0,0.0,0.2,0.0,0.0,0.0,0.0,0.0,0.0,Very Positive,Positive_emotion
amanitus,2016-05-29 05:46:30,shot person instead put misery,news,0.481,0.519,0.0,-0.5719,0.0,0.0,0.0,0.0,0.0,0.0,0.0,0.0,0.2,0.2,0.0,Very Negative,Fear
jay314271,2016-05-29 07:10:50,apostrophes guy made laugh,news,0.0,0.455,0.545,0.5574,0.0,0.0,0.0,0.0,0.0,0.0,0.0,0.0,0.0,0.0,0.0,Very Positive,Neutral
chiropter,2016-05-29 07:14:19,dude getting brigadedownvoted comments unotimetoexplainrun got comment removed id guess inciting witchhunt including said dudes username,news,0.0,1.0,0.0,0.0,0.0,0.0,0.0,0.0,0.0,0.0,0.0,0.0,0.0,0.0,0.0,Neutral,Neutral
Izira,2016-05-29 04:05:11,thankfully something harmless meaning edible unless diet staple shouldnt hurt gorilla cheetos walked past prairie dog enclosure noticed someone thrown decent amount trash yes notified someone god damn people,news,0.071,0.604,0.325,0.826,0.0,0.0,0.0,0.0,0.0,0.0,0.0,0.0,0.0,0.034482758620689655,0.034482758620689655,Very Positive,Pain
Carnae_Assada,2016-05-29 04:33:07,throwing cheetos cheetah enclosure probably would let slide,news,0.0,1.0,0.0,0.0,0.0,0.0,0.0,0.0,0.0,0.0,0.0,0.0,0.0,0.0,0.0,Neutral,Neutral
Scarlet-Witch,2016-05-29 05:06:39,saw something similar teenage couple string necklacebracelet cheerios trying feed giraffes,news,0.0,1.0,0.0,0.0,0.0,0.0,0.0,0.0,0.0,0.0,0.0,0.0,0.0,0.0,0.0,Neutral,Neutral
coffeeinvenice,2016-05-29 07:33:04,see zoos one place overpoliced average city street every zoo signs prominently posted saying zoo regulations enforced tsa visitors feed animals orotherwise violate zoo regulations subject mandatory cavity search,news,0.102,0.857,0.041,-0.4404,0.0,0.0,0.0,0.0,0.0,0.0,0.0,0.0,0.0,0.0,0.0,Negative,Neutral
NewNumberSeven,2016-05-29 05:26:44,problem zoos general throwing animals cage lifetime observed crowds people day day fucking inhumane dont understand still thing remember taking gf zoo last year seeing monkey picking arm hairs due obvious depression know sounds pretty hippy like come take many things granted human species could see zoos slowly dwindling away time people become intelligent realize isnt fucking game,news,0.093,0.753,0.155,0.5106,0.0,0.0,0.0,0.017241379310344827,0.0,0.0,0.0,0.0,0.0,0.0,0.05172413793103448,Very Positive,Negative_emotion
RikkiTikkiTaavi,2016-05-29 04:31:35,im zookeeper probably ask 23 people mostly kids plenty adults well every day knock glass exhibits people act ignorant didnt know bad thing every though get parent gets real defensive disciplining child,news,0.058,0.775,0.167,0.4497,0.0,0.03125,0.0,0.03125,0.0,0.0,0.0,0.0,0.0,0.03125,0.03125,Very Positive,Hate
turkey_sandwiches,2016-05-29 02:51:17,gtfo,news,0.0,1.0,0.0,0.0,0.0,0.0,0.0,0.0,0.0,0.0,0.0,0.0,0.0,0.0,0.0,Neutral,Neutral
hoodatninja,2016-05-29 05:02:40,see argument lot think reason see much news generates controversy sells b isnt norm,news,0.172,0.828,0.0,-0.3612,0.0,0.0,0.0,0.0,0.07142857142857142,0.0,0.0,0.0,0.0,0.0,0.07142857142857142,Negative,Positive_emotion
clancy6969,2016-05-29 08:59:48,im pretty curious deleted top comment,news,0.0,0.291,0.709,0.743,0.0,0.0,0.0,0.0,0.0,0.0,0.0,0.0,0.0,0.0,0.0,Very Positive,Neutral
Richy_T,2016-05-29 05:28:41,better falling fish tank eagled,news,0.213,0.4,0.387,0.3182,0.0,0.0,0.0,0.0,0.2,0.0,0.0,0.0,0.0,0.0,0.0,Very Positive,Positive_emotion
starrynight451,2016-05-29 05:57:08,massive percentage number know damned well theyre enjoy imbeciles like understand physical pain effective means communicating,news,0.218,0.332,0.45,0.6486,0.0,0.0,0.0,0.0,0.0,0.0,0.0,0.0625,0.0625,0.0625,0.0625,Very Positive,Anger
Butt_Barnacles,2016-05-29 05:25:30,wouldnt fun locked assholes enclosure viewing pleasure thats zoo would visit,news,0.155,0.458,0.388,0.6212,0.09090909090909091,0.0,0.0,0.09090909090909091,0.0,0.0,0.0,0.0,0.0,0.0,0.0,Very Positive,Love
p_U_c_K_IV,2016-05-29 04:32:35,sad cancer earth protection animals us take natural habitats amusement,news,0.405,0.324,0.27,-0.5423,0.0,0.0,0.0,0.0,0.0,0.0,0.0,0.0,0.0,0.0,0.1,Very Negative,Negative_emotion
ChewyIsMyC0Pil0t,2016-05-29 04:57:04,fantasize people shit get abducted aliens put alien zoos little green kids bang glass throw shit,news,0.447,0.553,0.0,-0.8885,0.0,0.0,0.0,0.0,0.0,0.0,0.0,0.0,0.0,0.0,0.0,Very Negative,Neutral
lilzilla,2016-05-29 13:39:11,fwiw probably hoping baby would distracted kitten stop screaming general fair bet see adult screaming baby action adult probably attempt make baby stop screaming,news,0.409,0.448,0.143,-0.8176,0.0,0.0,0.0,0.0,0.0,0.0,0.0,0.0,0.0,0.125,0.08333333333333333,Very Negative,Pain
goatsticks717,2016-05-29 04:51:09,shouldve screamed mothers face,news,0.434,0.566,0.0,-0.3182,0.0,0.0,0.0,0.0,0.0,0.0,0.0,0.0,0.25,0.25,0.0,Negative,Fear
pm_pics_of_bob_saget,2016-05-29 07:26:46,love story happy ending,news,0.0,0.202,0.798,0.836,0.25,0.0,0.0,0.0,0.5,0.0,0.0,0.0,0.0,0.0,0.0,Very Positive,Positive_emotion
astraldaisy,2016-05-29 05:41:01,im also cincy area amazing zoo incredible gorilla exhibit sad see animal put like especially silverback gorillas going extinct exhibit one favorites young child harambe missed parents please dont take lightly little boy could injured far worse pay attention children hire sitter,news,0.216,0.583,0.201,0.0422,0.0,0.023809523809523808,0.0,0.047619047619047616,0.0,0.0,0.0,0.0,0.0,0.023809523809523808,0.047619047619047616,Positive,Play
AT-ST,2016-05-29 04:32:03,girlfriend went cinnci zoo last fall super nice zoo might pictures gorilla,news,0.0,0.599,0.401,0.7717,0.0,0.0,0.0,0.0,0.0,0.0,0.0,0.0,0.0,0.08333333333333333,0.0,Very Positive,Pain
scathsiorai,2016-05-29 04:33:41,im current resident cincinnati would agree im planning leaving sometime next years,news,0.0,0.815,0.185,0.3612,0.0,0.0,0.0,0.0,0.0,0.08333333333333333,0.0,0.0,0.0,0.0,0.0,Very Positive,Trust
beeman4266,2016-05-29 04:38:10,well youre surrounded norhood newport countless shitty areas really cant expect much cincinnati overall depressing things people arent particularly great hey skyline chili dont know proud,news,0.347,0.594,0.059,-0.8797,0.0,0.0,0.0,0.0,0.07692307692307693,0.0,0.0,0.0,0.0,0.0,0.0,Very Negative,Positive_emotion
creynolds722,2016-05-29 04:51:00,dont know people columbus better im oblivious shitty zoo behavior zoo membership dont notice people terrible side note im spending night batavia cincinnatiish hah,news,0.12,0.699,0.181,0.2153,0.0,0.041666666666666664,0.0,0.0,0.041666666666666664,0.0,0.0,0.0,0.0,0.0,0.041666666666666664,Very Positive,Hate
AFarewellToBrahms,2016-05-29 04:35:25,sounds like awful residents take awful football team good know shouldnt visit cincinnati,news,0.294,0.441,0.265,-0.1531,0.0,0.15384615384615385,0.0,0.07692307692307693,0.0,0.0,0.0,0.0,0.0,0.0,0.0,Negative,Hate
TheCocksmith,2016-05-29 06:29:09,killed yet,news,0.818,0.182,0.0,-0.6705,0.0,0.0,0.0,0.0,0.0,0.0,0.0,0.0,0.0,0.0,0.5,Very Negative,Negative_emotion
huzzy,2016-05-29 07:31:33,panda panda panda panda panda panda,news,0.0,1.0,0.0,0.0,0.0,0.0,0.0,0.0,0.0,0.0,0.0,0.0,0.0,0.0,0.0,Neutral,Neutral
ULTIMATE_PUNCH_,2016-05-29 07:47:18,say,news,0.0,1.0,0.0,0.0,0.0,0.0,0.0,0.0,0.0,0.0,0.0,0.0,0.0,0.0,0.0,Neutral,Neutral
DeezNeezuts,2016-05-29 03:56:09,reminds kids got attacked tiger yes enclosure higher jesus tease apex predator point leaped moat kill go admire animals gtfo,news,0.325,0.487,0.188,-0.6369,0.0,0.05,0.0,0.0,0.0,0.0,0.05,0.0,0.0,0.05,0.05,Very Negative,Hate
MamaDelRey,2016-05-29 04:30:05,zoo hadnt anything like happen 38 years wouldnt call poor design everything cant 100 idiot proof people watch kids,news,0.09,0.685,0.225,0.4847,0.0,0.0,0.0,0.05263157894736842,0.0,0.0,0.0,0.0,0.0,0.0,0.0,Very Positive,Play
gfense,2016-05-29 03:01:05,ive seen people pick kids put top barriers see ive cincinnati zoo thats case could zoo done,news,0.0,0.899,0.101,0.2023,0.0,0.0,0.0,0.0,0.0,0.0,0.0,0.0,0.0,0.0,0.0,Very Positive,Neutral
Anxiety_Piglet,2016-05-29 05:07:51,understand people say mother watching several small children time turned check baby stroller child slipped took less 7 seconds whole situation terrible sure devastating beautiful animal put feel sorry zoo keepers lost charge well boys parents live everyday knowing momentary mistake cost animal life,news,0.236,0.617,0.146,-0.6249,0.022727272727272728,0.022727272727272728,0.0,0.022727272727272728,0.0,0.0,0.0,0.0,0.0,0.022727272727272728,0.045454545454545456,Very Negative,Negative_emotion
theatanamonster,2016-05-29 11:40:56,last remember giant fucking moat people gorillas wonder happened,news,0.0,1.0,0.0,0.0,0.0,0.0,0.0,0.0,0.0,0.0,0.0,0.0,0.0,0.0,0.1111111111111111,Neutral,Negative_emotion
KyanoTzoker,2016-05-29 06:54:42,dude visited beijing zoo fucking chinese tourists heads lettuce random greens throwing herbivores birds right next bilingual feed animals signs shittily low level respect nature everyone either smiling verily unimpressed lack entertainment flash photography nocturnal exhibit bilingual signs god damn rustled jimmies,news,0.174,0.624,0.202,0.3612,0.0,0.0,0.0,0.023809523809523808,0.023809523809523808,0.023809523809523808,0.0,0.0,0.0,0.0,0.047619047619047616,Very Positive,Negative_emotion
UCgirl,2016-05-29 04:56:38,news articles reporting three reporting four possible updated age point,news,0.0,1.0,0.0,0.0,0.0,0.0,0.0,0.0,0.0,0.0,0.0,0.0,0.0,0.0,0.0,Neutral,Neutral
secretlyacuttlefish,2016-05-29 10:14:04,awesome grandpa thankfully learned children guidance whats worse parents make excuses saying thats kids ignore let,news,0.229,0.49,0.282,0.3182,0.0,0.125,0.0,0.0,0.0,0.0,0.0,0.0,0.0,0.0,0.0625,Very Positive,Hate
CITY_F0X,2016-05-29 09:10:55,awesome grandpa wish one,news,0.0,0.227,0.773,0.7783,0.0,0.0,0.0,0.0,0.25,0.0,0.0,0.0,0.0,0.0,0.0,Very Positive,Positive_emotion
GunnerTardis,2016-05-29 16:18:25,parenting,news,0.0,1.0,0.0,0.0,0.0,0.0,0.0,0.0,0.0,0.0,0.0,0.0,0.0,0.0,0.0,Neutral,Neutral
Ace-of-Spades88,2016-05-29 13:48:04,grandfather hero,news,0.0,0.217,0.783,0.5574,0.0,0.0,0.0,0.0,0.0,0.0,0.0,0.0,0.0,0.0,0.0,Very Positive,Neutral
