Author,Date,Comment,Subreddit,VADER_neg,VADER_neu,VADER_pos,VADER_compound,EMPATH_love,EMPATH_hate,EMPATH_joy,EMPATH_play,EMPATH_positive_emotion,EMPATH_trust,EMPATH_aggression,EMPATH_anger,EMPATH_fear,EMPATH_pain,EMPATH_negative_emotion,Overall_VADER_sentiment,Overall_EMPATH_sentiment
johndoe555,2016-05-29 05:13:21,yeah seems waited 10 minutes shooting think childs life weighed infinitely heavily fear lawsuit one thing overlook automobile defect x number people statistically likely die point distant future another thing guy spot making decision could result kids death,news,0.314,0.615,0.072,-0.9153,0.0,0.0,0.0,0.0,0.0,0.0,0.02631578947368421,0.02631578947368421,0.02631578947368421,0.0,0.05263157894736842,Very Negative,Negative_emotion
Heavy_Rotation,2016-05-29 06:05:52,amount people thread seem forgotten wild gorilla truly means implication fact astounding live cincinnati visit zoo frequently ive also pleasure meeting mr maynard zoos director occasions award winning zoo recognized world many highly successful breeding programs say love care animals massive understatement absolutely devastating heartbreaking decision 100 make way determine gorillas thought process moment gauge certainy whether planned hurting child second child fell cage life grave danger gorilla grabbed child really viable alternative mistake made entire tragedy parents chose watch young child carefully,news,0.211,0.546,0.242,0.5801,0.024096385542168676,0.0,0.0,0.07228915662650602,0.024096385542168676,0.012048192771084338,0.0,0.0,0.0,0.012048192771084338,0.024096385542168676,Very Positive,Play
RainAndWind,2016-05-29 11:23:16,youre absolutely correct terrible happen even 20 chance gorilla going harm high risk 4 year old boy think parent would feel child parent control kid 100 time much would like believe,news,0.233,0.65,0.117,-0.6682,0.03225806451612903,0.03225806451612903,0.0,0.0967741935483871,0.0,0.0,0.0,0.0,0.0,0.03225806451612903,0.03225806451612903,Very Negative,Play
bapadaka,2016-05-29 17:47:19,kind like people,news,0.0,0.145,0.855,0.7096,0.0,0.0,0.0,0.0,0.0,0.0,0.0,0.0,0.0,0.0,0.0,Very Positive,Neutral
boldandbratsche,2016-05-29 05:01:38,humans wild animals like shark bear gorilla remarkably similar humans think koko gorilla literally talk,news,0.0,0.848,0.152,0.3612,0.0,0.0,0.0,0.0,0.0,0.0,0.0,0.0,0.0,0.0,0.0,Very Positive,Neutral
drewlinskii,2016-05-29 07:59:13,wouldnt really consider animal zoo wild animal anymore held captive entertainment viewing pleasure,news,0.0,0.629,0.371,0.7579,0.07692307692307693,0.0,0.0,0.07692307692307693,0.0,0.0,0.0,0.0,0.0,0.0,0.0,Very Positive,Love
banjaxe,2016-05-29 07:54:04,silverback gorillas endangered 3 year olds arent made wrong call preemptive edit im saying used tranquilizer let gorilla swing kid lightpost headfirst,news,0.049,0.839,0.113,0.3515,0.0,0.0,0.0,0.045454545454545456,0.0,0.045454545454545456,0.0,0.0,0.0,0.0,0.045454545454545456,Very Positive,Play
beachfootballer,2016-05-29 05:26:35,granted edited quite bit news clip witnesses know else happened,news,0.0,0.818,0.182,0.25,0.0,0.0,0.0,0.0,0.0,0.0,0.0,0.0,0.0,0.0,0.0,Very Positive,Neutral
YellIntoWishingWells,2016-05-29 05:14:28,day 17th birthday less,news,0.0,1.0,0.0,0.0,0.0,0.0,0.0,0.0,0.0,0.0,0.0,0.0,0.0,0.0,0.0,Neutral,Neutral
brianlpowers,2016-05-29 15:44:14,thanks posting hadnt seen bit yet,news,0.0,0.633,0.367,0.4404,0.0,0.0,0.0,0.0,0.0,0.0,0.0,0.0,0.0,0.0,0.0,Very Positive,Neutral
Anakin_Skywanker,2016-05-29 08:38:23,im actually cincinnati go zoo pretty frequently enclosure level viewing deck moat 1520 foot drop separating viewing deck moat wall ropes ten feet plants brush another small wall moat kid climbing shit minutes get,news,0.143,0.777,0.08,-0.3612,0.0,0.0,0.0,0.029411764705882353,0.0,0.0,0.0,0.0,0.0,0.0,0.0,Negative,Play
Justmetalking,2016-05-29 02:52:00,whats weird story fact hasnt happened entire 35 year history exhibit considering millions people would strange never happened makes think zoo may altered barrier recently thought,news,0.179,0.821,0.0,-0.4588,0.0,0.0,0.0,0.0,0.0,0.0,0.0,0.0,0.0,0.0,0.0,Negative,Neutral
SoliNocte,2016-05-29 02:50:00,used live cincinnati ive zoo enclose similar youre describing except longer walkway gates ends gorilla exhibit often closes earlier rest park gate sometimes,news,0.0,1.0,0.0,0.0,0.0,0.0,0.0,0.0,0.0,0.0,0.0,0.0,0.0,0.0,0.0,Neutral,Neutral
AlexanderPendrag,2016-05-29 09:51:53,thankfully almost certainly lose likely zoo settle outofcourt prevent publicity shitty situation highly doubt parents much wrong 3year olds terrifying,news,0.464,0.357,0.179,-0.8912,0.0,0.0,0.0,0.0,0.0,0.05,0.0,0.0,0.05,0.0,0.1,Very Negative,Negative_emotion
secret_asian_men,2016-05-29 23:47:22,lesson parents negative backlash kid hospital histheir fault punishment learn fucking gorilla died stupidity know many gorillas left many stupid people like world financial life important actual life,news,0.452,0.451,0.097,-0.9497,0.0,0.0,0.0,0.03571428571428571,0.0,0.0,0.0,0.0,0.0,0.0,0.10714285714285714,Very Negative,Negative_emotion
iamaquantumcomputer,2016-05-29 08:04:45,piece shit parents expectation safety visit zoo zoo foresight see small child could climb dangerous animals need idiot proof everything wasnt kid would happened kid eventually,news,0.287,0.632,0.08,-0.802,0.0,0.0,0.0,0.11538461538461539,0.0,0.0,0.038461538461538464,0.0,0.0,0.0,0.0,Very Negative,Play
kingofping4,2016-05-29 05:55:35,billions one thousands think time let stupid people stupid death think space well free activities,news,0.41,0.383,0.207,-0.743,0.0,0.0,0.0,0.0,0.0,0.0,0.0,0.0,0.0,0.0,0.2,Very Negative,Negative_emotion
trisight,2016-05-29 04:38:40,endangered species mean human life,news,0.0,1.0,0.0,0.0,0.0,0.0,0.0,0.0,0.0,0.0,0.0,0.0,0.0,0.0,0.2,Neutral,Negative_emotion
Sadsharks,2016-05-29 04:57:56,shit wonder mightve point,news,0.545,0.455,0.0,-0.5574,0.0,0.0,0.0,0.0,0.0,0.0,0.0,0.0,0.0,0.0,0.0,Very Negative,Neutral
p68,2016-05-29 22:16:47,theres also expectation people follow rules watch kids especially kid makes intent clear acting like case,news,0.0,0.733,0.267,0.6249,0.0,0.0,0.0,0.125,0.0,0.0,0.0625,0.0,0.0,0.0,0.0,Very Positive,Play
Vulpix0r,2016-05-30 01:40:54,would hilarious parents sued zoo incident see far push luck,news,0.0,0.584,0.416,0.6908,0.0,0.0,0.0,0.0,0.0,0.0,0.0,0.0,0.0,0.0,0.0,Very Positive,Neutral
Battle_Bee,2016-05-29 08:35:31,seriously youre advocating letting animal kill toddler probably would done gun hands situation suffer fate careless decisions 4 year olds dont know better morality issues aside would severely hurt zoos reputation would definitely taken court way letting child die,news,0.473,0.481,0.046,-0.9745,0.0,0.05128205128205128,0.0,0.05128205128205128,0.02564102564102564,0.02564102564102564,0.02564102564102564,0.0,0.0,0.07692307692307693,0.07692307692307693,Very Negative,Pain
ZileanQ,2016-05-29 08:53:26,stupid humans endangered suffer fate careless decisions thats easy say computer chair imagine leadership position dealing political fallout letting 4yearold child die im serious imagine public scandal hate mail stain reputation zoos im saying impossible could bear youre far majority stance,news,0.371,0.578,0.051,-0.9538,0.0,0.024390243902439025,0.0,0.024390243902439025,0.0,0.024390243902439025,0.0,0.0,0.0,0.024390243902439025,0.07317073170731707,Very Negative,Negative_emotion
Hooman_Bean,2016-05-29 16:57:35,100000 gorrilas 7000000000 humans saying,news,0.0,1.0,0.0,0.0,0.0,0.0,0.0,0.0,0.0,0.0,0.0,0.0,0.0,0.0,0.0,Neutral,Neutral
lovemymeemers,2016-05-30 19:01:33,since obviously arent familiar exhibit let help kid went barrier 20 ft shrubs fence 4ft 2 seconds laughably inaccurate,news,0.07,0.701,0.229,0.5267,0.0,0.0,0.0,0.05263157894736842,0.0,0.0,0.0,0.0,0.0,0.0,0.0,Very Positive,Play
jamesandlily_forever,2016-05-29 20:03:30,people let kids bad things time see every single day,news,0.28,0.72,0.0,-0.5423,0.0,0.1,0.0,0.0,0.0,0.0,0.0,0.0,0.0,0.1,0.1,Very Negative,Hate
total_looser,2016-05-29 17:45:42,one let us kid,news,0.0,1.0,0.0,0.0,0.0,0.0,0.0,0.25,0.0,0.0,0.0,0.0,0.0,0.0,0.0,Neutral,Play
totallyknowyou,2016-05-29 08:06:48,promise dont give fuck,news,0.0,0.28,0.72,0.631,0.0,0.0,0.0,0.0,0.0,0.25,0.0,0.0,0.0,0.0,0.0,Very Positive,Trust
musemusings,2016-05-29 07:15:49,child possession especially public place especially public place filled wild animals simply look away amount time appreciate slack youre giving youve never situation someone whos control upwards dozen kids helped raise three one vision impaired tell keep sight hold hand excuse toddler left devices public even moment dont know world around holds sounds like lot work heartbreaking parents dont take account procreate,news,0.042,0.763,0.196,0.8442,0.0,0.0,0.0,0.03225806451612903,0.016129032258064516,0.0,0.0,0.0,0.0,0.0,0.0,Very Positive,Play
FinallyNewShoes,2016-05-29 12:49:40,omg kids video arent restrained cant believe quick people call neglect,news,0.231,0.769,0.0,-0.4588,0.0,0.0,0.0,0.0,0.0,0.0,0.0,0.0,0.0,0.0,0.0,Negative,Neutral
baseline304,2016-05-29 04:36:41,live cincinnati zoo times last year lot exhibits seem easy fall especially gorilla exhibitmonkey area love zoo people work think least 6040 zoo fault,news,0.088,0.682,0.231,0.6597,0.041666666666666664,0.0,0.0,0.0,0.041666666666666664,0.0,0.0,0.0,0.0,0.041666666666666664,0.041666666666666664,Very Positive,Love
Kibbby,2016-05-29 06:54:46,woefully inadequate thats sure,news,0.621,0.115,0.264,-0.4767,0.0,0.0,0.0,0.0,0.0,0.0,0.0,0.0,0.0,0.0,0.0,Negative,Neutral
Sloppy_Twat,2016-05-29 04:41:14,idiot proof need make animal enclosures think child proofing animal enclosures would good enough ive never met 4 year old isnt idiot,news,0.24,0.655,0.105,-0.5719,0.0,0.0,0.0,0.045454545454545456,0.0,0.0,0.0,0.0,0.0,0.0,0.0,Very Negative,Play
Fuel_To_The_Flame,2016-05-29 05:15:31,clearly dont kids easy sounds keeping child sites side time really isnt bars loose enough kid fit feet away couldve easily happened even best parents,news,0.068,0.536,0.396,0.8915,0.0,0.0,0.0,0.08,0.0,0.0,0.0,0.0,0.0,0.0,0.04,Very Positive,Play
BarryBondsBalls,2016-05-29 05:10:25,agree dont let public,news,0.0,0.545,0.455,0.3612,0.0,0.0,0.0,0.0,0.0,0.25,0.0,0.0,0.0,0.0,0.0,Very Positive,Trust
nowandlater,2016-05-29 08:37:11,maybe parents assumed zoo built way kid couldnt get reasonable assumption blame zoo zoo knows plenty three year olds visit zoo know three year olds behave,news,0.088,0.912,0.0,-0.34,0.0,0.038461538461538464,0.0,0.038461538461538464,0.0,0.0,0.0,0.0,0.0,0.0,0.038461538461538464,Negative,Hate
Jaqen___Hghar,2016-05-29 04:28:36,amen excuse irresponsibility parent general stupidity,news,0.354,0.488,0.159,-0.3818,0.0,0.0,0.0,0.0,0.0,0.0,0.0,0.0,0.0,0.0,0.0,Negative,Neutral
Palindromer101,2016-05-29 10:56:21,someone used work zoo signed everywhere reminding feed animals watch fucking children,news,0.0,1.0,0.0,0.0,0.0,0.0,0.0,0.08333333333333333,0.0,0.0,0.0,0.0,0.0,0.0,0.08333333333333333,Neutral,Play
GandalfTheGayy_,2016-05-29 11:53:33,leaving eyes child around busy street moving cars leaving eyes child zoo completely different youd think something like zoo main attraction families would safe children know theres wild animals area thats never safe zoos job keep animals away people vice versa way child find regardless standing next parents wandered away people saying parents fault clearly never kids kids take eyes one second theyre half way another country zoo typically parents would like look around tragedy happened awful hear people witch hunt parents need chill kids tricky zoo wasnt safe,news,0.128,0.696,0.175,0.6369,0.011235955056179775,0.011235955056179775,0.0,0.033707865168539325,0.011235955056179775,0.033707865168539325,0.0,0.0,0.0,0.0,0.011235955056179775,Very Positive,Play
Obligatius,2016-05-29 08:00:57,id still weigh heavily parents fault whats really important discussion every tragedy focus blame instead accepting live dangerous world sometimes results difficult decisions gorillas even people die decisions need made choose live lives protective bubbles,news,0.375,0.533,0.093,-0.9361,0.0,0.02857142857142857,0.0,0.0,0.0,0.0,0.02857142857142857,0.0,0.0,0.0,0.08571428571428572,Very Negative,Negative_emotion
MagnusMcLongcock,2016-05-29 14:52:32,pay taxes zoo yeah thats works,news,0.184,0.526,0.289,0.2023,0.0,0.0,0.0,0.0,0.0,0.0,0.0,0.0,0.0,0.0,0.0,Very Positive,Neutral
DocJawbone,2016-05-29 19:46:30,kids run traffic get killed blaming parents would heartless,news,0.645,0.355,0.0,-0.8979,0.0,0.1111111111111111,0.0,0.0,0.0,0.0,0.0,0.0,0.0,0.0,0.1111111111111111,Very Negative,Hate
joshlittle333,2016-05-29 05:08:07,reddit run president,news,0.0,1.0,0.0,0.0,0.0,0.0,0.0,0.0,0.0,0.0,0.0,0.0,0.0,0.0,0.0,Neutral,Neutral
InsaneGenis,2016-05-29 04:51:45,dude talking grown ass man fall exhibit thats unacceptable,news,0.481,0.519,0.0,-0.7579,0.0,0.0,0.0,0.0,0.0,0.0,0.0,0.0,0.0,0.1111111111111111,0.0,Very Negative,Pain
Elmos_Voice,2016-05-29 04:23:54,person fucking child reddit seriously fucked,news,0.614,0.386,0.0,-0.7479,0.0,0.16666666666666666,0.0,0.16666666666666666,0.0,0.0,0.0,0.0,0.0,0.0,0.16666666666666666,Very Negative,Hate
SSJOtaku,2016-05-30 01:29:58,sorry sympathy member critically endangered species gorilla 7 billion humans counting,news,0.11,0.678,0.212,0.296,0.09090909090909091,0.0,0.0,0.0,0.0,0.0,0.0,0.0,0.0,0.0,0.0,Very Positive,Love
ReunionIsland,2016-05-29 04:34:15,lets realistic gorillas endangered humans dime per million argument beyond emotional appeal save children one make value childs life gorillas would sad child died sure gorilla important,news,0.233,0.481,0.286,0.0258,0.037037037037037035,0.0,0.0,0.037037037037037035,0.0,0.037037037037037035,0.0,0.0,0.0,0.0,0.037037037037037035,Positive,Love
Velcroguy,2016-05-29 03:38:15,last time went zoo zoos meant kids,news,0.0,1.0,0.0,0.0,0.0,0.0,0.0,0.0,0.0,0.0,0.0,0.0,0.0,0.0,0.0,Neutral,Neutral
epictetus1,2016-05-29 04:37:54,75 people zoo kids,news,0.0,1.0,0.0,0.0,0.0,0.0,0.0,0.0,0.0,0.0,0.0,0.0,0.0,0.0,0.0,Neutral,Neutral
Ttabts,2016-05-29 04:21:10,lol reddit exactly hes talking yall easily triggered topic children,news,0.0,0.606,0.394,0.6369,0.0,0.0,0.0,0.0,0.0,0.0,0.0,0.0,0.0,0.0,0.0,Very Positive,Neutral
voxanimus,2016-05-29 04:29:16,fuckin gorillas cant catch break man sucks get screwed evolution,news,0.416,0.584,0.0,-0.6908,0.0,0.0,0.0,0.0,0.0,0.0,0.0,0.0,0.0,0.0,0.1,Very Negative,Negative_emotion
Ozzyo520,2016-05-29 05:02:03,simplicity brilliant,news,0.0,0.208,0.792,0.5859,0.0,0.0,0.0,0.0,0.0,0.0,0.0,0.0,0.0,0.0,0.0,Very Positive,Neutral
ForeverTimon,2016-05-29 06:30:55,eh think every kid dumb 3 years old save offspring dumb ones though,news,0.351,0.479,0.17,-0.5267,0.0,0.0,0.0,0.07692307692307693,0.0,0.07692307692307693,0.0,0.0,0.0,0.0,0.0,Very Negative,Play
SWatersmith,2016-05-29 15:59:05,supply demand 7 billion human shitbags mountain gorillas remaining 17000000000 11000 numerically idiot kids life worth much less,news,0.232,0.676,0.092,-0.4404,0.0,0.0,0.0,0.0,0.0,0.0,0.0,0.0,0.0,0.0,0.0,Negative,Neutral
Downvoterofall,2016-05-29 03:28:45,social media sites opinion like get disliked,news,0.265,0.49,0.245,-0.0516,0.0,0.0,0.0,0.0,0.0,0.0,0.0,0.0,0.0,0.0,0.0,Negative,Neutral
saucebucket,2016-05-29 02:24:07,realize humans animals right,news,0.0,1.0,0.0,0.0,0.0,0.0,0.0,0.0,0.0,0.0,0.0,0.0,0.0,0.0,0.0,Neutral,Neutral
AshThatFirstBro,2016-05-29 03:50:33,humans animals,news,0.0,1.0,0.0,0.0,0.0,0.0,0.0,0.0,0.0,0.0,0.0,0.0,0.0,0.0,0.0,Neutral,Neutral
HappyraptorZ,2016-05-29 11:00:51,im big animal lover damn shame majestic animal unfortunately killed today im rather sad however im glad trying tranquilise could caused become eratic perhaps causing harm child putting seemed like best option wont judge intelligence parents intelligence child whether deserve die instead gorilla better men made similar mistakes circumstances childs life always worth animal life perhaps reddit lost perspective,news,0.354,0.45,0.196,-0.9301,0.01694915254237288,0.0,0.0,0.03389830508474576,0.03389830508474576,0.01694915254237288,0.0,0.01694915254237288,0.01694915254237288,0.0,0.06779661016949153,Very Negative,Negative_emotion
Nexre,2016-05-29 09:55:56,pretty good one young human age puberty legal age majority,news,0.0,0.479,0.521,0.765,0.0,0.0,0.0,0.0,0.0,0.0,0.0,0.0,0.0,0.0,0.0,Very Positive,Neutral
an_ill_mallard,2016-05-29 05:18:59,well alternative bullet yeah say go massively high dose tranquilliser first,news,0.0,0.677,0.323,0.5106,0.0,0.0,0.0,0.0,0.0,0.0,0.0,0.0,0.0,0.0,0.0,Very Positive,Neutral
MrMallow,2016-05-29 07:50:26,yes many less lethal options tried first,news,0.0,0.69,0.31,0.4019,0.0,0.0,0.0,0.0,0.0,0.0,0.14285714285714285,0.0,0.0,0.0,0.0,Very Positive,Aggression
asianfatboy,2016-05-29 04:59:21,genuinely curious tazer animals like instantly incapacitate theres thing even itd take whole lot electricity knock 400 lbs gorilla,news,0.0,0.78,0.22,0.5859,0.0,0.0,0.0,0.0,0.0,0.0,0.0,0.0,0.0,0.0,0.0,Very Positive,Neutral
Matrix_V,2016-05-29 05:16:11,think need know little bit tranquilized multiple times,news,0.0,0.867,0.133,0.0202,0.0,0.0,0.0,0.0,0.0,0.0,0.0,0.0,0.0,0.0,0.0,Positive,Neutral
Cato_Keto_Cigars,2016-05-29 04:24:06,tranq shoot didnt work go first killing,news,0.576,0.424,0.0,-0.7783,0.0,0.0,0.0,0.0,0.0,0.0,0.0,0.0,0.0,0.0,0.14285714285714285,Very Negative,Negative_emotion
electricfoxx,2016-05-29 14:49:27,glad english classes gone waste,news,0.318,0.341,0.341,0.0516,0.0,0.0,0.0,0.0,0.2,0.0,0.0,0.0,0.0,0.0,0.0,Very Positive,Positive_emotion
Delinquent_,2016-05-30 09:44:17,good bad irrelevant gorilla concept run instincts nature gorilla bad gorilla,news,0.391,0.447,0.162,-0.6249,0.0,0.18181818181818182,0.0,0.0,0.0,0.0,0.0,0.0,0.0,0.18181818181818182,0.18181818181818182,Very Negative,Hate
rook2pawn,2016-05-29 07:20:41,kill children heartbeat work people kill children without regard serves national interest saddams royal guard afghanistan etc dont want know know royal guard ok middle eastern children whatever takes keep peace oil flowing actual calculation leaders make determining killing children okay means get say top terrorist leader downing jet etc corporations famous formula basically percentage chance wrongful death lawsuits known defects automobiles times award amount vs cost recall gm knowingly let hundreds people die mostly young people amounts fifty cent replacement piece ignition switch still dont know werent charged manslaughter nation passively actively sadly,news,0.286,0.561,0.153,-0.9615,0.010638297872340425,0.02127659574468085,0.0,0.0,0.010638297872340425,0.0,0.02127659574468085,0.0,0.0,0.02127659574468085,0.05319148936170213,Very Negative,Negative_emotion
noirthesable,2016-05-29 14:22:04,radiolab interesting segment regarding firefighter died controlled forest fire made help bring back endangered bird species ill see find,news,0.312,0.496,0.191,-0.5267,0.0,0.0,0.0,0.0,0.0,0.0,0.0,0.0,0.0,0.0,0.0,Very Negative,Neutral
SmokeWine,2016-05-29 05:15:51,feel like biggest difference gorilla spend rest life cage least one might 3 year old boy grow man maybe husbandfather maybe doctor scientist knows people put value things always put ifs unfortunately gorilla ifs werent valued boys,news,0.115,0.767,0.117,0.0243,0.02702702702702703,0.0,0.0,0.02702702702702703,0.0,0.0,0.0,0.0,0.0,0.02702702702702703,0.0,Positive,Love
WatleyShrimpweaver,2016-05-29 04:37:04,feel free subract whenever want,news,0.0,0.395,0.605,0.5574,0.2,0.0,0.0,0.0,0.0,0.0,0.0,0.0,0.0,0.2,0.0,Very Positive,Love
Nepluton,2016-05-29 05:53:12,amazing little empathy compassion radio users holy shit 3 year old child kind fucking monsters people,news,0.147,0.449,0.405,0.7447,0.125,0.0,0.0625,0.0625,0.125,0.0,0.0,0.0,0.0,0.0,0.0625,Very Positive,Love
malcontent_seahorse,2016-05-29 05:36:37,nope brotherson puts effort breaking enclosure hope gorilla ends math favor period reap sow case thats true case lucked due society use child presents behavior presents benefit species 7 billion us totally expendable wanna fuck gorilla habitat means first line find happens love youbut obviously youre parent youre biased couldnt possibly make non biased argument im emotionally invested fuck 3 year old gorilla us favor parents get sad species benefits good fewer problematic 3 year olds,news,0.195,0.548,0.257,0.756,0.013157894736842105,0.0,0.0,0.013157894736842105,0.02631578947368421,0.013157894736842105,0.0,0.0,0.0,0.0,0.013157894736842105,Very Positive,Positive_emotion
Garrett_Dark,2016-05-29 09:35:57,actually want talk legalitiesif accidentally kill somebody arent automatically negligent negligence fact accident would legal repercussions furthermore apply legalities situationthe gorillas deemed people law boy therefore theres legal priority protect boy gorillasto otherwise could considered grossly negligent subject legal repercussions hey dont look thats law works,news,0.21,0.643,0.146,-0.7717,0.0,0.021739130434782608,0.0,0.043478260869565216,0.0,0.0,0.021739130434782608,0.0,0.0,0.021739130434782608,0.043478260869565216,Very Negative,Play
chocotaco_man,2016-05-29 09:18:59,youre parent three year old stoo tie shoe youre wasiting dpouse get phobe soon grab lsves toddler runs bushes gap bars fence falls enclosure still reaponsible thats reports say happened kid fucking kid parents parents zoo could used bars fences animal died tragic owell,news,0.136,0.864,0.0,-0.765,0.0,0.0,0.0,0.06818181818181818,0.0,0.0,0.0,0.0,0.0,0.0,0.022727272727272728,Very Negative,Play
respeckKnuckles,2016-05-29 15:29:53,person responded wasnt talking homeopathy either,news,0.0,1.0,0.0,0.0,0.0,0.0,0.0,0.0,0.0,0.0,0.0,0.0,0.0,0.0,0.16666666666666666,Neutral,Negative_emotion
Polamora,2016-05-29 04:47:00,tranquilizer throw rest kids looking exhibit well forgets first one,news,0.098,0.714,0.188,0.25,0.0,0.0,0.0,0.0,0.0,0.0,0.0,0.0,0.0,0.0,0.0,Very Positive,Neutral
cpnurrenberg,2016-05-29 06:43:38,got chuckle thoroughly depressing thread thanks,news,0.246,0.255,0.499,0.4535,0.0,0.0,0.0,0.0,0.0,0.0,0.0,0.0,0.0,0.0,0.0,Very Positive,Neutral
TheCuteTachikoma,2016-05-29 02:56:21,remember woman got face hands ripped friends crazed chimpanzee gorillaif gorilla started harm child probably would mean death youd dead child dead endangered gorilla love animals heart aches put endangered animal people luxury discuss reddit outcome situation poor soul make split decsisondo kill thing see things play zoo acted gorilla tranqed harm come boy reddit lynch mob general population bet would screaming closing zoo zoo staff unfortunate situation fronts,news,0.36,0.544,0.096,-0.9792,0.014492753623188406,0.014492753623188406,0.0,0.057971014492753624,0.014492753623188406,0.014492753623188406,0.014492753623188406,0.0,0.014492753623188406,0.028985507246376812,0.07246376811594203,Very Negative,Negative_emotion
tuigger,2016-05-29 03:27:13,thats 400 pound gorilla could accidentally break neck zoo faced sad story news killing gorilla faced millions lawsuits tranquilizing,news,0.481,0.519,0.0,-0.9001,0.0,0.0,0.0,0.0,0.0,0.0,0.0,0.0,0.0,0.0,0.15789473684210525,Very Negative,Negative_emotion
Destiny_fire,2016-05-29 03:00:02,youve possibly got child line fire moving target instantly kill kid faster shooter react movement aggression besides animals often dont die quickly shot unless hit directly head even small animal like coyote deer take several rifle rounds keep right trucking thats carry revolver along rifle hunting dangerous game clean head shot something built like gorilla would terrifically easy shot number imaginable situations hate shot many variables take chances shooter situation,news,0.174,0.615,0.211,0.1144,0.0,0.02857142857142857,0.0,0.04285714285714286,0.014285714285714285,0.0,0.04285714285714286,0.014285714285714285,0.0,0.02857142857142857,0.07142857142857142,Very Positive,Negative_emotion
sadashn,2016-05-29 05:18:48,gorillas life worth less humans thats something youre going come terms,news,0.0,0.84,0.16,0.2263,0.0,0.0,0.0,0.0,0.0,0.0,0.0,0.0,0.0,0.0,0.0,Very Positive,Neutral
BigDaddy_Delta,2016-05-29 04:59:51,many humans gorillas,news,0.0,1.0,0.0,0.0,0.0,0.0,0.0,0.0,0.0,0.0,0.0,0.0,0.0,0.0,0.0,Neutral,Neutral
UnderAchievingDog,2016-05-29 02:33:15,3 year old doesnt accidentally fall gorilla enclosure parents werent paying attention kid extended time crowded zoo something anyone could defend,news,0.0,0.903,0.097,0.2584,0.0,0.0,0.0,0.047619047619047616,0.0,0.047619047619047616,0.047619047619047616,0.0,0.0,0.047619047619047616,0.0,Very Positive,Play
Cageweek,2016-05-29 08:22:20,yeah thread goddamn awful mention extremely edgy,news,0.496,0.325,0.179,-0.5994,0.0,0.14285714285714285,0.0,0.0,0.0,0.0,0.0,0.0,0.0,0.0,0.0,Very Negative,Hate
stubbazubba,2016-05-29 12:46:00,reddit antichild antiparent pretty much every opportunity gets,news,0.0,0.5,0.5,0.7184,0.0,0.0,0.0,0.0,0.0,0.0,0.0,0.0,0.0,0.0,0.0,Very Positive,Neutral
emotionalboys2001,2016-05-30 03:35:30,kid 3 christ sakes,news,0.0,1.0,0.0,0.0,0.0,0.0,0.0,0.25,0.0,0.0,0.0,0.0,0.0,0.0,0.0,Neutral,Play
asuth,2016-05-29 03:10:59,foster care punishes parents great kid,news,0.231,0.224,0.545,0.6369,0.0,0.0,0.0,0.16666666666666666,0.3333333333333333,0.16666666666666666,0.0,0.0,0.0,0.0,0.16666666666666666,Very Positive,Positive_emotion
ecksboy,2016-05-29 03:44:06,turns people empathize baby torn pieces wild animal tear baby pieces reason think theres hope us yet,news,0.101,0.754,0.146,0.2263,0.0,0.0,0.0,0.0,0.11764705882352941,0.0,0.0,0.0,0.0,0.058823529411764705,0.058823529411764705,Very Positive,Positive_emotion
SanJuan_GreatWhites,2016-05-29 17:27:06,youre romanticizing gorilla intelligence cant understand gun serious doubts extent ability use sign language,news,0.104,0.38,0.516,0.7689,0.0,0.0,0.0,0.0,0.0,0.0,0.0,0.0,0.0,0.0,0.0,Very Positive,Neutral
