Author,Date,Comment,Subreddit,VADER_neg,VADER_neu,VADER_pos,VADER_compound,EMPATH_love,EMPATH_hate,EMPATH_joy,EMPATH_play,EMPATH_positive_emotion,EMPATH_trust,EMPATH_aggression,EMPATH_anger,EMPATH_fear,EMPATH_pain,EMPATH_negative_emotion,Overall_VADER_sentiment,Overall_EMPATH_sentiment
argentgrove,2016-05-29 01:15:06,sad zoos animals didnt man try commit suicide lion recently lion killed,news,0.636,0.364,0.0,-0.9324,0.0,0.0,0.0,0.0,0.0,0.0,0.0,0.0,0.0,0.0,0.16666666666666666,Very Negative,Negative_emotion
Knittingpasta,2016-05-29 03:39:24,remember older news story kid fell gorilla enclosure female gorilla treated gently like knew hurt child zoo keepers successfully returned kid parents without hurting gorilla,news,0.099,0.582,0.319,0.762,0.0,0.0,0.0,0.12,0.0,0.0,0.0,0.0,0.0,0.08,0.08,Very Positive,Play
soupcansam21,2016-05-29 05:39:30,totally lost thats okay overlooked gorillas keepers know multiple people zoo including worked gorilla killed devastated especially main gorilla keeper truly like losing family member given much time spend animals bond build,news,0.319,0.518,0.163,-0.8036,0.0,0.0,0.0,0.0,0.0625,0.0,0.0,0.0,0.0,0.0,0.09375,Very Negative,Negative_emotion
PateranTika,2016-05-29 06:02:36,worked aquarium signs put feed fish throw anything water knock glass see parents encourage kids parents well wonder kids assholes,news,0.145,0.649,0.206,0.1531,0.0,0.0,0.0,0.0,0.0,0.0,0.0,0.0,0.0,0.0,0.0,Very Positive,Neutral
deleted,2016-05-29 02:21:45,removed,news,0.0,1.0,0.0,0.0,0.0,0.0,0.0,0.0,0.0,0.0,0.0,0.0,0.0,0.0,0.0,Neutral,Neutral
bearchyllz,2016-05-29 04:37:34,little sister threw water bottle lid galapagos tortoise hold 8 6 started crying big tortoise almost ate worker came scolded sister told fucking stupid,news,0.254,0.746,0.0,-0.7778,0.0,0.0,0.0,0.0,0.0,0.0,0.0,0.0,0.0,0.0,0.125,Very Negative,Negative_emotion
hammilithome,2016-05-29 06:22:49,shame leashing roaming toddler,news,0.508,0.492,0.0,-0.4767,0.0,0.0,0.0,0.25,0.0,0.0,0.0,0.25,0.25,0.0,0.0,Negative,Play
tenderboob,2016-05-29 06:58:40,upset happening live minutes away cinci zoo gorilla killed 17th birthday ive read news stories witnesses saying child 3 literally told mother going go inside enclosure mother still ignored kid long enough happen although fences keep gorillas arent tallest pretty much parents fault neglectful opinion im extremely biased love zoo god damn dont take children zoo one fall enclosure get endangered animal killed,news,0.322,0.601,0.077,-0.9625,0.015873015873015872,0.0,0.0,0.031746031746031744,0.031746031746031744,0.015873015873015872,0.0,0.0,0.0,0.015873015873015872,0.06349206349206349,Very Negative,Negative_emotion
KevinGarvey0208,2016-05-29 04:25:26,cincinnati citizen ive zoo handful times seen exhibit one hard comment yes would fairly easy exhibit fall especially curious little boy climbing things said parent child young aware things child would get extreme anxiety let eyes even second area unfortunate situation everybody,news,0.121,0.716,0.163,0.4754,0.0,0.0,0.0,0.07142857142857142,0.0,0.0,0.0,0.0,0.023809523809523808,0.023809523809523808,0.023809523809523808,Very Positive,Play
Talyns,2016-05-29 02:26:24,summer camp counselor ive take 54 kids zoo past four years havent let one fall yet,news,0.0,1.0,0.0,0.0,0.0,0.0,0.0,0.0,0.0,0.0,0.0,0.0,0.0,0.0625,0.0,Neutral,Pain
H2talal,2016-05-29 01:13:29,zoo bill parents expense would enormous gorilllas creatures put like although zoo clearly struggles decision horrible sad event,news,0.333,0.476,0.19,-0.5994,0.0,0.05555555555555555,0.0,0.0,0.0,0.0,0.0,0.0,0.0,0.0,0.1111111111111111,Very Negative,Negative_emotion
FireLily56,2016-05-29 13:11:09,gotta ask legal repercussions parents facing hell little boy manage climb barrier get edge without parent guardian noticing stopping absolutely horrific lack parenting skills,news,0.434,0.522,0.044,-0.9256,0.0,0.0,0.0,0.041666666666666664,0.0,0.0,0.0,0.0,0.0,0.0,0.041666666666666664,Very Negative,Play
Sir_Meow,2016-05-29 18:29:59,kids family get bill costs related event,news,0.0,1.0,0.0,0.0,0.0,0.0,0.0,0.0,0.14285714285714285,0.0,0.0,0.0,0.0,0.0,0.0,Neutral,Positive_emotion
trancepx,2016-05-29 05:32:24,youre walking around minding business extraterrestrial youth accidentally falls realm nowhere alien authorities kill protect alien child imagine might react lol,news,0.084,0.596,0.32,0.7742,0.0,0.047619047619047616,0.0,0.047619047619047616,0.0,0.0,0.047619047619047616,0.0,0.0,0.047619047619047616,0.09523809523809523,Very Positive,Negative_emotion
kaydpea,2016-05-29 08:00:26,tough decision im cincinnati personally know people work gorillas tell tough barely covers probably one hardest decisions peoples lives said obviously also right one guys cincinnati zoo absolutely love animals youd hard pressed find better run zoo country,news,0.098,0.737,0.165,0.7178,0.02631578947368421,0.0,0.0,0.0,0.05263157894736842,0.0,0.0,0.0,0.0,0.0,0.02631578947368421,Very Positive,Positive_emotion
sseidl88,2016-05-29 04:35:01,feel sad around,news,0.608,0.392,0.0,-0.4767,0.3333333333333333,0.0,0.0,0.0,0.0,0.0,0.0,0.0,0.0,0.3333333333333333,0.3333333333333333,Negative,Love
Mariondrew,2016-05-29 09:00:20,zoo sue family,news,0.0,1.0,0.0,0.0,0.0,0.0,0.0,0.0,0.3333333333333333,0.0,0.0,0.0,0.0,0.0,0.0,Neutral,Positive_emotion
37-pieces-of-flair,2016-05-29 05:27:46,guess much expect parents supervise kids,news,0.0,1.0,0.0,0.0,0.0,0.0,0.0,0.0,0.0,0.0,0.0,0.0,0.0,0.0,0.0,Neutral,Neutral
TBAMF,2016-05-29 01:37:58,sucks gorillas birthday yesterday 17 years drain negligent parents,news,0.238,0.762,0.0,-0.3612,0.0,0.0,0.0,0.0,0.0,0.0,0.0,0.0,0.0,0.0,0.0,Negative,Neutral
SassySachmo,2016-05-29 20:19:34,far past 6 months baby dolphin 2 lions baby bison gorilla killed shitty people,news,0.448,0.552,0.0,-0.8442,0.0,0.0,0.0,0.0,0.0,0.0,0.0,0.0,0.0,0.0,0.07142857142857142,Very Negative,Negative_emotion
futurecop,2016-05-29 13:14:55,hope parents held responsible,news,0.0,0.278,0.722,0.6369,0.0,0.0,0.0,0.0,0.25,0.25,0.0,0.0,0.0,0.0,0.0,Very Positive,Positive_emotion
Bassdropwobwob,2016-05-29 18:29:32,hope family gets fined watch fucking kids wtf,news,0.314,0.462,0.223,-0.2911,0.0,0.0,0.0,0.125,0.25,0.0,0.0,0.0,0.0,0.0,0.125,Negative,Positive_emotion
chasingthunder,2016-05-29 20:46:14,didnt fall climbed enclosure straight told mother going go ignored gorilla encounter steel grate barrier rail fence series bushes 12foot moat inbetween silverbacks visitors zoo cant idiot proof every exhibit one dumbass city zoo woman responsible demon spawn runs daycare kids day,news,0.147,0.716,0.137,-0.1275,0.0,0.0,0.0,0.0,0.0,0.023809523809523808,0.0,0.0,0.0,0.023809523809523808,0.0,Negative,Trust
Katm234,2016-05-29 07:51:18,hate bitch criticizes parents go traumatic experience like holy shit fuck let kid even end situation,news,0.643,0.28,0.078,-0.9595,0.0625,0.0625,0.0,0.0625,0.0,0.0,0.0,0.0,0.0,0.0,0.0625,Very Negative,Love
tif2shuz,2016-05-29 19:15:21,basically innocent animal endangered murdered asshole people couldnt keep eye kid properly fuck really held responsible freaking idiots,news,0.379,0.449,0.172,-0.7897,0.0,0.0,0.0,0.05555555555555555,0.05555555555555555,0.05555555555555555,0.0,0.0,0.0,0.0,0.0,Very Negative,Play
yamajama,2016-05-29 04:50:34,admit agree whats said top comments single childless male aka member reddits largest demographic betcha would super pissed literally thousands people calling us neglectful parents due reasonable possibility could rather unfortunate still serious 1 minute lapse judgement know one event concerning parents lets jump conclusions,news,0.2,0.626,0.174,-0.3612,0.0,0.0,0.0,0.0,0.0,0.022222222222222223,0.0,0.0,0.0,0.0,0.022222222222222223,Negative,Trust
ninguen,2016-05-29 10:04:50,hope parents left kid unattended paying costs takes amend situation theres way amend least hope made pay gorilla expansion project huge amount money,news,0.049,0.667,0.284,0.7717,0.0,0.0,0.0,0.043478260869565216,0.08695652173913043,0.0,0.0,0.0,0.0,0.0,0.0,Very Positive,Positive_emotion
drunzae,2016-05-29 06:37:48,fuck lets kid fall gorilla enclosure,news,0.412,0.588,0.0,-0.5423,0.0,0.0,0.0,0.16666666666666666,0.0,0.0,0.0,0.0,0.0,0.16666666666666666,0.0,Very Negative,Play
Jbcdrhn,2016-05-29 02:26:03,comments thread sad watching news cincinnati apparently bars big enough child fall protected scant bushes according interviewee apparently child went bush fell like split second kid spinted two feet fhe pit freak accident instead freakishly irresponsible parents idiots accidentally drop kids hyena exhibits ive seen case 3 year old three cage unsafe idiots think kid sacrificed preserve endangered gorilla welcome demonstrate viewpoint child fall gorilla pit edit typed shitty phone,news,0.248,0.657,0.095,-0.91,0.0,0.0,0.0,0.07142857142857142,0.0,0.0,0.0,0.0,0.0,0.02857142857142857,0.02857142857142857,Very Negative,Play
ThatScottishBesterd,2016-05-29 07:23:44,critically endangered animal shot dead childs parents shitty parents thats damn shame,news,0.631,0.369,0.0,-0.9287,0.0,0.0,0.0,0.0,0.0,0.0,0.0,0.08333333333333333,0.08333333333333333,0.0,0.08333333333333333,Very Negative,Anger
Forthosewhohaveheart,2016-05-29 07:14:29,17th birthday,news,0.0,1.0,0.0,0.0,0.0,0.0,0.0,0.0,0.0,0.0,0.0,0.0,0.0,0.0,0.0,Neutral,Neutral
kicks-on-route-666,2016-05-30 17:47:18,reply comment raising kids responsibility level regarding child raising honestly one biggest reasons people give rchildfree kids im father children grown ime friendsrelatives parents tell seems toddlers desperately trying get lost killed andor abducted theyre public places theres absolutely real sense judgement theyre fast lethal combination scary fuck dont even get started becoming teenagers id angry parents seen easily breachable zoos barrier appears knowing whats like raise children even didnt anything publicly terrible dangerous,news,0.276,0.618,0.106,-0.9505,0.013513513513513514,0.02702702702702703,0.0,0.013513513513513514,0.013513513513513514,0.02702702702702703,0.04054054054054054,0.0,0.013513513513513514,0.013513513513513514,0.06756756756756757,Very Negative,Negative_emotion
crossedstaves,2016-05-29 04:21:54,need reactionary kneejerk certainty could way come understandable accident allowance parents make even momentary screw lives article gives us information happened insight parents zoo design dont need magic answer dont need know blame righteous anger everyone immediately constructs little scenario parents failed someone blame bad thing completely bullshit maybe parents negligent maybe zoo design problems maybe fucked accident sad without needing blame people enough information blame people,news,0.341,0.552,0.108,-0.975,0.0,0.08955223880597014,0.0,0.0,0.014925373134328358,0.0,0.014925373134328358,0.014925373134328358,0.0,0.014925373134328358,0.11940298507462686,Very Negative,Negative_emotion
silentz0r,2016-05-29 05:47:21,animal killed order save person person responsible charged whatever consequences kill animal plus endangering case whoever responsible looking child time held responsible animals death childs safety,news,0.333,0.379,0.288,-0.6124,0.0,0.038461538461538464,0.0,0.038461538461538464,0.0,0.15384615384615385,0.038461538461538464,0.0,0.0,0.038461538461538464,0.11538461538461539,Very Negative,Trust
FurtiveNeptune,2016-05-29 13:06:50,yet find information parents child sight info,news,0.0,1.0,0.0,0.0,0.0,0.0,0.0,0.14285714285714285,0.0,0.0,0.0,0.0,0.0,0.0,0.0,Neutral,Play
Wupta,2016-05-30 06:34:54,parent 3 5 year old membership zoo wife always go everything together know tough one parent look two kids reason wife gone zoo without last time wanted dont want judge would like know facts first,news,0.077,0.852,0.071,0.1969,0.0,0.0,0.0,0.0,0.02857142857142857,0.0,0.0,0.0,0.0,0.0,0.05714285714285714,Very Positive,Negative_emotion
danfrom83,2016-05-30 19:38:02,dude kid fell cage huge gorilla could easily rip apart youre instinct human would protect kid cost costs regardless youre dumb parent taken better care kid know lots idiot parents shouldnt kids careless tired poor gorilla posts come shit,news,0.225,0.473,0.303,0.3851,0.0,0.0,0.0,0.07692307692307693,0.05128205128205128,0.02564102564102564,0.0,0.0,0.0,0.0,0.02564102564102564,Very Positive,Play
ThtOneWhiteDude,2016-05-31 04:21:39,tragedy zoo faculty made right choice given heartbreaking circumstances could risked human life waiting tranquilizers kick poor gorillas death entirely fault parent kid climb guardrail sharp wires may may electrified moat wall family fined roof publicly berated unfortunately probably going happen get bunch internet memes course week pita use fodder againt zoos gorillas captivity unfair treatment animals general family representative hold press conference explaining apologized dont understand millions people internet news cruel please stop consider feelings family going difficult time stop mean us current wild animal enclosures every zoo country undergo major renovations cost already struggling zoos rescue facilities happiness animals meet new stricter safety guidelines,news,0.301,0.6,0.1,-0.9794,0.009433962264150943,0.009433962264150943,0.009433962264150943,0.009433962264150943,0.03773584905660377,0.0,0.0,0.0,0.0,0.009433962264150943,0.04716981132075472,Very Negative,Negative_emotion
P4ndamonium,2016-05-29 09:00:30,goddamn pay fucking attention kids,news,0.6,0.4,0.0,-0.5423,0.0,0.0,0.0,0.0,0.0,0.0,0.0,0.0,0.0,0.0,0.2,Very Negative,Negative_emotion
notquiteotaku,2016-05-29 02:49:33,kids fault 3 year olds going explore get shit gorillas fault wild animal parents supervising kid properly endangered animal would still alive son wouldnt traumatized,news,0.274,0.578,0.148,-0.63,0.0,0.0,0.0,0.04,0.04,0.0,0.0,0.0,0.0,0.0,0.08,Very Negative,Negative_emotion
heartattack0,2016-05-29 18:24:40,damn parents wouldve ended trip right saw attempting go handrail beat ass got home parents shouldve taught kid better,news,0.247,0.637,0.116,-0.5106,0.0,0.0,0.0,0.05263157894736842,0.05263157894736842,0.0,0.0,0.0,0.0,0.0,0.05263157894736842,Very Negative,Play
trevclapp,2016-05-29 22:13:42,hope zoo presses charges parents neglected watch child trainers lost family member brat,news,0.396,0.457,0.147,-0.5994,0.0,0.0,0.0,0.15384615384615385,0.15384615384615385,0.0,0.0,0.0,0.0,0.0,0.07692307692307693,Very Negative,Play
GoldenBudda,2016-05-29 14:21:49,hope kids family gets huge fine parents prevented ever happening endangered animal dead idiot child,news,0.308,0.364,0.328,-0.3612,0.0,0.0,0.0,0.06666666666666667,0.13333333333333333,0.0,0.0,0.0,0.0,0.0,0.06666666666666667,Negative,Positive_emotion
DJunieB,2016-05-29 04:06:43,hmmmm prosecute parents leaving child hot car pet owner leaves pet hot car let kid look crooked another kid school see fast get sued parents deemed accountable everything kids say except convenient like innocent animal lose life irresponsible parents watching child everyone gets trophy everyone gets pass one accountable generation incompetent parents probably sue zoo next trick reason tragedy like never happened zoo 36 years nothing enclosure designed would happened long obviously parents something important watching 3 year old children removed home,news,0.175,0.73,0.095,-0.8316,0.0,0.0,0.0,0.06097560975609756,0.012195121951219513,0.0,0.0,0.0,0.0,0.0,0.024390243902439025,Very Negative,Play
merganzer,2016-05-29 02:42:39,happens usually stupid parent boosting kid see drops however 36inch child climb fence around exhibit would good reevaluate design protection animals people alike take threeyearold zoo often shes barely tall enough peer exhibits usually let stand feet front hold baby sister three feet solid concrete topped outwardly angled bars handsbreadth apart absolutely way climb crawl slide barriers good toddlers irrational beings move quickly choose,news,0.079,0.788,0.133,0.4588,0.0,0.0,0.0,0.03125,0.0,0.0,0.0,0.0,0.0,0.0,0.015625,Very Positive,Play
Kpheg5953,2016-05-29 06:51:05,someone seen exhibit question several times parent two young boys say beyond shadow doubt zoos fault chest high fence several feet past fence falls separating gap case parent paying attention god damn thing going,news,0.198,0.75,0.053,-0.7003,0.0,0.0,0.0,0.0,0.0,0.0,0.0,0.0,0.0,0.0,0.029411764705882353,Very Negative,Negative_emotion
Xenjael,2016-05-29 07:43:58,kid fall repercussions parents,news,0.0,1.0,0.0,0.0,0.0,0.0,0.0,0.25,0.0,0.0,0.0,0.0,0.0,0.25,0.0,Neutral,Play
herewegoaga1n,2016-05-29 04:12:38,friend get arm broken elephant zoo drunk high stupid happened adult fact people royally stupid species cant fix stupid,news,0.492,0.408,0.1,-0.91,0.0,0.0,0.0,0.0,0.05263157894736842,0.0,0.0,0.0,0.0,0.0,0.21052631578947367,Very Negative,Negative_emotion
walking_dead_girl,2016-05-29 02:27:24,parents banned life zoo negligence put childs life danger also cost endangered animal life,news,0.348,0.652,0.0,-0.7506,0.0,0.0,0.0,0.0,0.0,0.0,0.0,0.0,0.0,0.0,0.0,Very Negative,Neutral
OtherDrake,2016-05-29 02:47:08,gorilla didnt ask put zoo lil human fell home sounds like humans assholes,news,0.22,0.636,0.145,-0.3182,0.0,0.0,0.0,0.0,0.0,0.0,0.0,0.0,0.0,0.0,0.0,Negative,Neutral
5thchoice,2016-05-29 06:37:16,wouldnt let niece fall gorilla pit parents arrested child endangerment,news,0.256,0.744,0.0,-0.4767,0.0,0.0,0.0,0.1,0.0,0.0,0.0,0.0,0.0,0.1,0.0,Negative,Play
k3vin187,2016-05-29 08:29:05,happened reddit like 4chan without humor,news,0.218,0.481,0.301,0.1744,0.0,0.0,0.16666666666666666,0.0,0.0,0.0,0.0,0.0,0.0,0.0,0.0,Very Positive,Joy
createch,2016-05-29 08:30:44,sad ive worked gorillas face face yes males violent usually towards threats dominance theyre gentle creatures otherwise sad truth seems curious wouldnt harmed kid,news,0.311,0.338,0.351,-0.089,0.0,0.0,0.0,0.041666666666666664,0.0,0.041666666666666664,0.041666666666666664,0.0,0.08333333333333333,0.0,0.125,Negative,Negative_emotion
Renegade787,2016-05-29 12:39:28,see lawsuit coming parents agree court law likely take prima facie case child nosy unable make conscious decisions zoo proper barriers design zoo keep children gorilla pit,news,0.065,0.85,0.085,0.1531,0.0,0.0,0.0,0.037037037037037035,0.037037037037037035,0.037037037037037035,0.0,0.0,0.0,0.0,0.0,Very Positive,Play
eternalbuzz,2016-05-29 07:05:44,kid falls lion pen shoot dozen lions parents making excuses brought life world protect negligence negligence completely reasonable cps get involved also someone said zoo would face lawsuit didnt shoot gorilla kid fell enclosure negligence pay dafuq,news,0.19,0.749,0.061,-0.5423,0.0,0.0,0.0,0.05405405405405406,0.0,0.0,0.0,0.0,0.02702702702702703,0.0,0.0,Very Negative,Play
ewiener22,2016-05-29 15:07:33,parents child held accountable death gorilla keep eye fucking children christs sake,news,0.262,0.738,0.0,-0.5994,0.0,0.0,0.0,0.08333333333333333,0.08333333333333333,0.0,0.0,0.0,0.0,0.0,0.16666666666666666,Very Negative,Negative_emotion
wic0101,2016-05-30 05:39:16,tune back next week coverage parents suing zoo endangering child guarantee,news,0.16,0.687,0.153,-0.0258,0.0,0.0,0.0,0.09090909090909091,0.0,0.09090909090909091,0.0,0.0,0.0,0.0,0.0,Neutral,Play
Joshthathipsterkid,2016-05-29 02:24:37,itt let 3 year old die attacked gorilla spare life,news,0.496,0.504,0.0,-0.7845,0.0,0.0,0.0,0.0,0.0,0.0,0.0,0.0,0.0,0.0,0.1,Very Negative,Negative_emotion
ilglokta,2016-05-29 05:12:32,im inclined assume done zoo world 4 year old cant get trouble running around unsupervised love cincinnati zoo one best country far superior columbus nickel dime admission individual exhibits,news,0.0,0.629,0.371,0.9344,0.034482758620689655,0.0,0.0,0.0,0.034482758620689655,0.0,0.0,0.0,0.0,0.0,0.034482758620689655,Very Positive,Love
meatboitantan,2016-05-29 14:19:04,fucking people thread arguing whether 3 year old physically able get gorilla enclosure im believing parent never ever aware kid public parents say otherwise lazy fit parenting know shit like happens arent watching people watch kid,news,0.211,0.676,0.113,-0.6557,0.0,0.0,0.0,0.08333333333333333,0.0,0.0,0.0,0.0,0.0,0.0,0.027777777777777776,Very Negative,Play
teslaxoxo,2016-05-29 07:10:23,pretty sadim pretty sure shitty parentinghow could keeping eye 4 year oldshitty parents sure parents first one raise hell son dont get wants people meant procreate,news,0.215,0.497,0.288,0.2023,0.0,0.0,0.0,0.0,0.0,0.0,0.0,0.0,0.0,0.0,0.038461538461538464,Very Positive,Negative_emotion
Iateagrilledcheese,2016-05-29 16:10:21,cincinnati zoo layout guard rail wires 23 foot wide area bushes 15 foot wide moat 10 foot drop viewing area supposed back plan someone get passed fence gorillas dont get humans vice versa never seenheard gorilla jumping moat would take efforttime get moat love cincy zoo biased opinion parents fault death gorilla kid falling moat,news,0.189,0.747,0.064,-0.7351,0.01818181818181818,0.0,0.0,0.01818181818181818,0.01818181818181818,0.0,0.0,0.0,0.0,0.0,0.03636363636363636,Very Negative,Negative_emotion
BaPef,2016-05-29 17:28:22,think parents get huge fine get easy fuck maybe volunteer gorilla exhibit zoo year,news,0.171,0.488,0.341,0.3612,0.0,0.0,0.0,0.0,0.0,0.0,0.0,0.0,0.0,0.0,0.0,Very Positive,Neutral
bluedawn1971,2016-05-29 18:47:52,parents responsible children least theyre supposed child 18,news,0.0,0.753,0.247,0.3182,0.0,0.0,0.0,0.125,0.0,0.125,0.0,0.0,0.0,0.0,0.0,Very Positive,Play
SaikoGekido,2016-06-01 04:15:32,kid going traumatized life imagine amount hate going get school one question didnt tranquilize gorilla instead shoot,news,0.435,0.565,0.0,-0.8411,0.0,0.058823529411764705,0.0,0.058823529411764705,0.0,0.0,0.0,0.0,0.0,0.0,0.058823529411764705,Very Negative,Hate
ReallyFnCleverName,2016-05-29 06:07:06,really dont get people defending parents parent theres excuse letting kid dont care distraction maybe even emergency needed something guess grab kid hand ensure know theyre attend next thing ive many occasions alone daughter 4 hands free look say grab pocket move handle need millions people went past exhibit 35 years nothing happened safe bet one time something happened clearly different one thing seems parent completely lost track kid decent amount time unacceptable parenting period different situation parents lack attention led death child walking street drowning pool getting poisoned etc itd negligence way time different reason,news,0.205,0.667,0.127,-0.8535,0.0,0.0,0.0,0.041666666666666664,0.020833333333333332,0.020833333333333332,0.0,0.0,0.0,0.0,0.052083333333333336,Very Negative,Negative_emotion
mastrj,2016-05-29 06:22:21,truly tragedy kid grows edgy knowitall redditor,news,0.358,0.407,0.236,-0.3612,0.0,0.0,0.0,0.14285714285714285,0.0,0.0,0.0,0.0,0.0,0.0,0.0,Negative,Play
cigar1975,2016-05-29 04:21:49,sad gorilla gorillas gonna,news,0.508,0.492,0.0,-0.4767,0.0,0.0,0.0,0.0,0.0,0.0,0.0,0.0,0.0,0.0,0.25,Negative,Negative_emotion
GroundFyter,2016-05-29 05:34:17,shit makes hot like fish grease fucking watch kids,news,0.275,0.534,0.191,-0.2732,0.0,0.0,0.0,0.1111111111111111,0.0,0.0,0.0,0.0,0.0,0.0,0.1111111111111111,Negative,Play
whoapony,2016-05-29 08:40:10,let natural selection continue,news,0.0,0.545,0.455,0.3612,0.0,0.0,0.0,0.0,0.0,0.0,0.0,0.0,0.0,0.0,0.0,Very Positive,Neutral
rj20876,2016-05-29 03:52:01,honestly dont think id like know anyone posting thread talking fucking kneejerk reactions absolutely facts,news,0.117,0.718,0.166,0.224,0.0,0.0,0.0,0.0,0.06666666666666667,0.06666666666666667,0.0,0.0,0.0,0.0,0.06666666666666667,Very Positive,Positive_emotion
gopec,2016-05-29 04:19:19,perfect world zoo would sue dipshit parents poor kid destroy animal,news,0.475,0.343,0.181,-0.7184,0.0,0.0,0.0,0.09090909090909091,0.0,0.0,0.0,0.0,0.0,0.0,0.0,Very Negative,Play
DragonTamerMCT,2016-05-29 06:25:01,ahh time thread already reddits guide animal human hierarchy animals always come humans unless youre arguing eating meat case vegans idiots thinking shouldnt kill animals cuter ape like worse remember let humans die order save zoo animals,news,0.244,0.575,0.181,-0.5047,0.0,0.05405405405405406,0.0,0.0,0.0,0.02702702702702703,0.02702702702702703,0.0,0.0,0.02702702702702703,0.10810810810810811,Very Negative,Negative_emotion
Visigoth84,2016-05-29 06:59:13,bastards id smack damned parents heads stupidity leaving child like costa critically endangered gorilla life,news,0.413,0.478,0.109,-0.7906,0.0,0.0,0.0,0.06666666666666667,0.0,0.0,0.0,0.0,0.0,0.0,0.0,Very Negative,Play
tryndamererage,2016-05-29 01:42:18,id say taken risk tranquilizer,news,0.516,0.484,0.0,-0.296,0.0,0.0,0.0,0.0,0.0,0.0,0.0,0.0,0.0,0.0,0.0,Negative,Neutral
HonoluluLion,2016-05-29 22:31:22,enclosure child negligent parents proof,news,0.0,1.0,0.0,0.0,0.0,0.0,0.0,0.2,0.0,0.0,0.0,0.0,0.0,0.0,0.0,Neutral,Play
MrPennywise,2016-05-30 07:30:04,way hell isnt parents fault,news,0.467,0.304,0.229,-0.5175,0.0,0.0,0.0,0.0,0.0,0.0,0.0,0.0,0.0,0.0,0.4,Very Negative,Negative_emotion
moschles,2016-05-29 22:14:58,tiny boy get gorilla enclosure single journalist cnn answered question single journalist cnn even asked question mr greenshirt camera said nothing topic single reporter bbc said anything address question mean seriously first topic address little kid simply step rock prestochango swimming 400lb silverbacks zoo culpable 12foot tall chainlink fence barbed wire top gorilla exhibits precisely reason thing reporters said boy slipped enclosure fuck even happen slipped wtf even mean metropolitan zoos work united states slip next thing know arms ripped gorillas seriously,news,0.117,0.832,0.05,-0.7269,0.0,0.024390243902439025,0.0,0.036585365853658534,0.012195121951219513,0.0,0.0,0.0,0.0,0.0,0.036585365853658534,Very Negative,Play
